tcpdump: listening on eth0, link-type EN10MB (Ethernet), snapshot length 262144 bytes
1735295414.719551 IP (tos 0x10, ttl 64, id 12590, offset 0, flags [DF], proto TCP (6), length 176)
    5.75.242.14.22 > 79.224.127.251.59979: Flags [P.], cksum 0xc7d7 (incorrect -> 0xa394), seq 458946148:458946272, ack 3869229696, win 501, options [nop,nop,TS val 4068070828 ecr 4289544055], length 124
1735295414.740639 IP (tos 0x0, ttl 55, id 0, offset 0, flags [none], proto TCP (6), length 52)
    79.224.127.251.59979 > 5.75.242.14.22: Flags [.], cksum 0xfa28 (correct), ack 124, win 2046, options [nop,nop,TS val 4289544143 ecr 4068070828], length 0
1735295414.806828 IP (tos 0x10, ttl 64, id 12591, offset 0, flags [DF], proto TCP (6), length 192)
    5.75.242.14.22 > 79.224.127.251.59979: Flags [P.], cksum 0xc7e7 (incorrect -> 0x45be), seq 124:264, ack 1, win 501, options [nop,nop,TS val 4068070915 ecr 4289544143], length 140
1735295414.807535 IP (tos 0x10, ttl 64, id 12592, offset 0, flags [DF], proto TCP (6), length 552)
    5.75.242.14.22 > 79.224.127.251.59979: Flags [P.], cksum 0xc94f (incorrect -> 0xcd70), seq 264:764, ack 1, win 501, options [nop,nop,TS val 4068070916 ecr 4289544143], length 500
1735295414.852654 IP (tos 0x0, ttl 55, id 0, offset 0, flags [none], proto TCP (6), length 52)
    79.224.127.251.59979 > 5.75.242.14.22: Flags [.], cksum 0xf8ee (correct), ack 264, win 2045, options [nop,nop,TS val 4289544231 ecr 4068070915], length 0
1735295414.852654 IP (tos 0x0, ttl 55, id 0, offset 0, flags [none], proto TCP (6), length 52)
    79.224.127.251.59979 > 5.75.242.14.22: Flags [.], cksum 0xf6fc (correct), ack 764, win 2040, options [nop,nop,TS val 4289544233 ecr 4068070916], length 0
1735295414.909465 IP (tos 0x10, ttl 64, id 12593, offset 0, flags [DF], proto TCP (6), length 1168)
    5.75.242.14.22 > 79.224.127.251.59979: Flags [P.], cksum 0xcbb7 (incorrect -> 0x0682), seq 764:1880, ack 1, win 501, options [nop,nop,TS val 4068071018 ecr 4289544233], length 1116
1735295414.931438 IP (tos 0x0, ttl 55, id 0, offset 0, flags [none], proto TCP (6), length 52)
    79.224.127.251.59979 > 5.75.242.14.22: Flags [.], cksum 0xf1e0 (correct), ack 1880, win 2030, options [nop,nop,TS val 4289544333 ecr 4068071018], length 0
1735295415.013474 IP (tos 0x10, ttl 64, id 12594, offset 0, flags [DF], proto TCP (6), length 632)
    5.75.242.14.22 > 79.224.127.251.59979: Flags [P.], cksum 0xc99f (incorrect -> 0x863f), seq 1880:2460, ack 1, win 501, options [nop,nop,TS val 4068071122 ecr 4289544333], length 580
1735295415.035421 IP (tos 0x0, ttl 55, id 0, offset 0, flags [none], proto TCP (6), length 52)
    79.224.127.251.59979 > 5.75.242.14.22: Flags [.], cksum 0xeec3 (correct), ack 2460, win 2038, options [nop,nop,TS val 4289544438 ecr 4068071122], length 0
1735295415.117424 IP (tos 0x10, ttl 64, id 12595, offset 0, flags [DF], proto TCP (6), length 632)
    5.75.242.14.22 > 79.224.127.251.59979: Flags [P.], cksum 0xc99f (incorrect -> 0xb243), seq 2460:3040, ack 1, win 501, options [nop,nop,TS val 4068071226 ecr 4289544438], length 580
1735295415.151895 IP (tos 0x0, ttl 55, id 0, offset 0, flags [none], proto TCP (6), length 52)
    79.224.127.251.59979 > 5.75.242.14.22: Flags [.], cksum 0xebad (correct), ack 3040, win 2038, options [nop,nop,TS val 4289544544 ecr 4068071226], length 0
1735295415.221492 IP (tos 0x10, ttl 64, id 12596, offset 0, flags [DF], proto TCP (6), length 632)
    5.75.242.14.22 > 79.224.127.251.59979: Flags [P.], cksum 0xc99f (incorrect -> 0x0448), seq 3040:3620, ack 1, win 501, options [nop,nop,TS val 4068071330 ecr 4289544544], length 580
1735295415.242152 IP (tos 0x0, ttl 55, id 0, offset 0, flags [none], proto TCP (6), length 52)
    79.224.127.251.59979 > 5.75.242.14.22: Flags [.], cksum 0xe89c (correct), ack 3620, win 2038, options [nop,nop,TS val 4289544645 ecr 4068071330], length 0
1735295415.325359 IP (tos 0x10, ttl 64, id 12597, offset 0, flags [DF], proto TCP (6), length 632)
    5.75.242.14.22 > 79.224.127.251.59979: Flags [P.], cksum 0xc99f (incorrect -> 0xbcf5), seq 3620:4200, ack 1, win 501, options [nop,nop,TS val 4068071434 ecr 4289544645], length 580
1735295415.347670 IP (tos 0x0, ttl 55, id 0, offset 0, flags [none], proto TCP (6), length 52)
    79.224.127.251.59979 > 5.75.242.14.22: Flags [.], cksum 0xe586 (correct), ack 4200, win 2038, options [nop,nop,TS val 4289544751 ecr 4068071434], length 0
1735295415.429463 IP (tos 0x10, ttl 64, id 12598, offset 0, flags [DF], proto TCP (6), length 632)
    5.75.242.14.22 > 79.224.127.251.59979: Flags [P.], cksum 0xc99f (incorrect -> 0x4aac), seq 4200:4780, ack 1, win 501, options [nop,nop,TS val 4068071538 ecr 4289544751], length 580
1735295415.451648 IP (tos 0x0, ttl 55, id 0, offset 0, flags [none], proto TCP (6), length 52)
    79.224.127.251.59979 > 5.75.242.14.22: Flags [.], cksum 0xe274 (correct), ack 4780, win 2038, options [nop,nop,TS val 4289544853 ecr 4068071538], length 0
1735295415.533493 IP (tos 0x10, ttl 64, id 12599, offset 0, flags [DF], proto TCP (6), length 632)
    5.75.242.14.22 > 79.224.127.251.59979: Flags [P.], cksum 0xc99f (incorrect -> 0xeaeb), seq 4780:5360, ack 1, win 501, options [nop,nop,TS val 4068071642 ecr 4289544853], length 580
1735295415.555918 IP (tos 0x0, ttl 55, id 0, offset 0, flags [none], proto TCP (6), length 52)
    79.224.127.251.59979 > 5.75.242.14.22: Flags [.], cksum 0xdf5e (correct), ack 5360, win 2038, options [nop,nop,TS val 4289544959 ecr 4068071642], length 0
1735295415.637453 IP (tos 0x10, ttl 64, id 12600, offset 0, flags [DF], proto TCP (6), length 632)
    5.75.242.14.22 > 79.224.127.251.59979: Flags [P.], cksum 0xc99f (incorrect -> 0xdd1f), seq 5360:5940, ack 1, win 501, options [nop,nop,TS val 4068071746 ecr 4289544959], length 580
1735295415.659652 IP (tos 0x0, ttl 55, id 0, offset 0, flags [none], proto TCP (6), length 52)
    79.224.127.251.59979 > 5.75.242.14.22: Flags [.], cksum 0xdc4c (correct), ack 5940, win 2038, options [nop,nop,TS val 4289545061 ecr 4068071746], length 0
1735295415.741425 IP (tos 0x10, ttl 64, id 12601, offset 0, flags [DF], proto TCP (6), length 632)
    5.75.242.14.22 > 79.224.127.251.59979: Flags [P.], cksum 0xc99f (incorrect -> 0xeaa2), seq 5940:6520, ack 1, win 501, options [nop,nop,TS val 4068071850 ecr 4289545061], length 580
1735295415.765900 IP (tos 0x0, ttl 55, id 0, offset 0, flags [none], proto TCP (6), length 52)
    79.224.127.251.59979 > 5.75.242.14.22: Flags [.], cksum 0xd934 (correct), ack 6520, win 2038, options [nop,nop,TS val 4289545169 ecr 4068071850], length 0
1735295415.845546 IP (tos 0x10, ttl 64, id 12602, offset 0, flags [DF], proto TCP (6), length 632)
    5.75.242.14.22 > 79.224.127.251.59979: Flags [P.], cksum 0xc99f (incorrect -> 0x0cfe), seq 6520:7100, ack 1, win 501, options [nop,nop,TS val 4068071954 ecr 4289545169], length 580
1735295415.865482 IP (tos 0x0, ttl 55, id 0, offset 0, flags [none], proto TCP (6), length 52)
    79.224.127.251.59979 > 5.75.242.14.22: Flags [.], cksum 0xd624 (correct), ack 7100, win 2038, options [nop,nop,TS val 4289545269 ecr 4068071954], length 0
1735295415.949519 IP (tos 0x10, ttl 64, id 12603, offset 0, flags [DF], proto TCP (6), length 632)
    5.75.242.14.22 > 79.224.127.251.59979: Flags [P.], cksum 0xc99f (incorrect -> 0xb53c), seq 7100:7680, ack 1, win 501, options [nop,nop,TS val 4068072058 ecr 4289545269], length 580
1735295415.972121 IP (tos 0x0, ttl 55, id 0, offset 0, flags [none], proto TCP (6), length 52)
    79.224.127.251.59979 > 5.75.242.14.22: Flags [.], cksum 0xd310 (correct), ack 7680, win 2038, options [nop,nop,TS val 4289545373 ecr 4068072058], length 0
1735295416.053529 IP (tos 0x10, ttl 64, id 12604, offset 0, flags [DF], proto TCP (6), length 632)
    5.75.242.14.22 > 79.224.127.251.59979: Flags [P.], cksum 0xc99f (incorrect -> 0x8234), seq 7680:8260, ack 1, win 501, options [nop,nop,TS val 4068072162 ecr 4289545373], length 580
1735295416.075181 IP (tos 0x0, ttl 55, id 0, offset 0, flags [none], proto TCP (6), length 52)
    79.224.127.251.59979 > 5.75.242.14.22: Flags [.], cksum 0xcff1 (correct), ack 8260, win 2048, options [nop,nop,TS val 4289545478 ecr 4068072162], length 0
1735295416.157457 IP (tos 0x10, ttl 64, id 12605, offset 0, flags [DF], proto TCP (6), length 632)
    5.75.242.14.22 > 79.224.127.251.59979: Flags [P.], cksum 0xc99f (incorrect -> 0x5b7c), seq 8260:8840, ack 1, win 501, options [nop,nop,TS val 4068072266 ecr 4289545478], length 580
1735295416.179404 IP (tos 0x0, ttl 55, id 0, offset 0, flags [none], proto TCP (6), length 52)
    79.224.127.251.59979 > 5.75.242.14.22: Flags [.], cksum 0xccdc (correct), ack 8840, win 2048, options [nop,nop,TS val 4289545583 ecr 4068072266], length 0
1735295416.261512 IP (tos 0x10, ttl 64, id 12606, offset 0, flags [DF], proto TCP (6), length 632)
    5.75.242.14.22 > 79.224.127.251.59979: Flags [P.], cksum 0xc99f (incorrect -> 0xc605), seq 8840:9420, ack 1, win 501, options [nop,nop,TS val 4068072370 ecr 4289545583], length 580
1735295416.285883 IP (tos 0x0, ttl 55, id 0, offset 0, flags [none], proto TCP (6), length 52)
    79.224.127.251.59979 > 5.75.242.14.22: Flags [.], cksum 0xc9c6 (correct), ack 9420, win 2048, options [nop,nop,TS val 4289545689 ecr 4068072370], length 0
1735295416.369346 IP (tos 0x10, ttl 64, id 12607, offset 0, flags [DF], proto TCP (6), length 632)
    5.75.242.14.22 > 79.224.127.251.59979: Flags [P.], cksum 0xc99f (incorrect -> 0x2f9b), seq 9420:10000, ack 1, win 501, options [nop,nop,TS val 4068072478 ecr 4289545689], length 580
1735295416.389418 IP (tos 0x0, ttl 55, id 0, offset 0, flags [none], proto TCP (6), length 52)
    79.224.127.251.59979 > 5.75.242.14.22: Flags [.], cksum 0xc6ae (correct), ack 10000, win 2048, options [nop,nop,TS val 4289545793 ecr 4068072478], length 0
1735295416.477461 IP (tos 0x10, ttl 64, id 12608, offset 0, flags [DF], proto TCP (6), length 632)
    5.75.242.14.22 > 79.224.127.251.59979: Flags [P.], cksum 0xc99f (incorrect -> 0x3217), seq 10000:10580, ack 1, win 501, options [nop,nop,TS val 4068072586 ecr 4289545793], length 580
1735295416.500151 IP (tos 0x0, ttl 55, id 0, offset 0, flags [none], proto TCP (6), length 52)
    79.224.127.251.59979 > 5.75.242.14.22: Flags [.], cksum 0xc390 (correct), ack 10580, win 2048, options [nop,nop,TS val 4289545903 ecr 4068072586], length 0
1735295416.581498 IP (tos 0x10, ttl 64, id 12609, offset 0, flags [DF], proto TCP (6), length 632)
    5.75.242.14.22 > 79.224.127.251.59979: Flags [P.], cksum 0xc99f (incorrect -> 0xdc25), seq 10580:11160, ack 1, win 501, options [nop,nop,TS val 4068072690 ecr 4289545903], length 580
1735295416.601663 IP (tos 0x0, ttl 55, id 0, offset 0, flags [none], proto TCP (6), length 52)
    79.224.127.251.59979 > 5.75.242.14.22: Flags [.], cksum 0xc07e (correct), ack 11160, win 2048, options [nop,nop,TS val 4289546005 ecr 4068072690], length 0
1735295416.621590 IP6 (flowlabel 0xe3e35, hlim 242, next-header TCP (6) payload length: 24) 2a06:4880:a000::c0.57572 > 2a01:4f8:c012:fd6::1.1027: Flags [S], cksum 0x16d9 (correct), seq 841424673, win 14600, options [mss 1440], length 0
1735295416.621619 IP6 (flowlabel 0x63ce2, hlim 64, next-header TCP (6) payload length: 20) 2a01:4f8:c012:fd6::1.1027 > 2a06:4880:a000::c0.57572: Flags [R.], cksum 0x1244 (incorrect -> 0x6776), seq 0, ack 841424674, win 0, length 0
1735295416.685715 IP (tos 0x10, ttl 64, id 12610, offset 0, flags [DF], proto TCP (6), length 1104)
    5.75.242.14.22 > 79.224.127.251.59979: Flags [P.], cksum 0xcb77 (incorrect -> 0x3fcb), seq 11160:12212, ack 1, win 501, options [nop,nop,TS val 4068072794 ecr 4289546005], length 1052
1735295416.707153 IP (tos 0x0, ttl 55, id 0, offset 0, flags [none], proto TCP (6), length 52)
    79.224.127.251.59979 > 5.75.242.14.22: Flags [.], cksum 0xbb91 (correct), ack 12212, win 2048, options [nop,nop,TS val 4289546110 ecr 4068072794], length 0
1735295416.789440 IP (tos 0x10, ttl 64, id 12611, offset 0, flags [DF], proto TCP (6), length 640)
    5.75.242.14.22 > 79.224.127.251.59979: Flags [P.], cksum 0xc9a7 (incorrect -> 0x4100), seq 12212:12800, ack 1, win 501, options [nop,nop,TS val 4068072898 ecr 4289546110], length 588
1735295416.809967 IP (tos 0x0, ttl 55, id 0, offset 0, flags [none], proto TCP (6), length 52)
    79.224.127.251.59979 > 5.75.242.14.22: Flags [.], cksum 0xb876 (correct), ack 12800, win 2048, options [nop,nop,TS val 4289546213 ecr 4068072898], length 0
1735295416.893511 IP (tos 0x10, ttl 64, id 12612, offset 0, flags [DF], proto TCP (6), length 632)
    5.75.242.14.22 > 79.224.127.251.59979: Flags [P.], cksum 0xc99f (incorrect -> 0xd57d), seq 12800:13380, ack 1, win 501, options [nop,nop,TS val 4068073002 ecr 4289546213], length 580
1735295416.914664 IP (tos 0x0, ttl 55, id 0, offset 0, flags [none], proto TCP (6), length 52)
    79.224.127.251.59979 > 5.75.242.14.22: Flags [.], cksum 0xb562 (correct), ack 13380, win 2048, options [nop,nop,TS val 4289546317 ecr 4068073002], length 0
1735295416.997489 IP (tos 0x10, ttl 64, id 12613, offset 0, flags [DF], proto TCP (6), length 632)
    5.75.242.14.22 > 79.224.127.251.59979: Flags [P.], cksum 0xc99f (incorrect -> 0x2b18), seq 13380:13960, ack 1, win 501, options [nop,nop,TS val 4068073106 ecr 4289546317], length 580
1735295417.017182 IP (tos 0x0, ttl 55, id 0, offset 0, flags [none], proto TCP (6), length 52)
    79.224.127.251.59979 > 5.75.242.14.22: Flags [.], cksum 0xb24e (correct), ack 13960, win 2048, options [nop,nop,TS val 4289546421 ecr 4068073106], length 0
1735295417.101485 IP (tos 0x10, ttl 64, id 12614, offset 0, flags [DF], proto TCP (6), length 632)
    5.75.242.14.22 > 79.224.127.251.59979: Flags [P.], cksum 0xc99f (incorrect -> 0x5978), seq 13960:14540, ack 1, win 501, options [nop,nop,TS val 4068073210 ecr 4289546421], length 580
1735295417.124387 IP (tos 0x0, ttl 55, id 0, offset 0, flags [none], proto TCP (6), length 52)
    79.224.127.251.59979 > 5.75.242.14.22: Flags [.], cksum 0xaf38 (correct), ack 14540, win 2048, options [nop,nop,TS val 4289546527 ecr 4068073210], length 0
1735295417.205500 IP (tos 0x10, ttl 64, id 12615, offset 0, flags [DF], proto TCP (6), length 632)
    5.75.242.14.22 > 79.224.127.251.59979: Flags [P.], cksum 0xc99f (incorrect -> 0x93e4), seq 14540:15120, ack 1, win 501, options [nop,nop,TS val 4068073314 ecr 4289546527], length 580
1735295417.234661 IP (tos 0x0, ttl 55, id 0, offset 0, flags [none], proto TCP (6), length 52)
    79.224.127.251.59979 > 5.75.242.14.22: Flags [.], cksum 0xac26 (correct), ack 15120, win 2048, options [nop,nop,TS val 4289546629 ecr 4068073314], length 0
1735295417.309558 IP (tos 0x10, ttl 64, id 12616, offset 0, flags [DF], proto TCP (6), length 632)
    5.75.242.14.22 > 79.224.127.251.59979: Flags [P.], cksum 0xc99f (incorrect -> 0x27b4), seq 15120:15700, ack 1, win 501, options [nop,nop,TS val 4068073418 ecr 4289546629], length 580
1735295417.323909 IP (tos 0x0, ttl 55, id 869, offset 0, flags [none], proto ICMP (1), length 80)
    79.224.127.251 > 5.75.242.14: ICMP host 79.224.127.251 unreachable, length 60
    IP (tos 0x0, ttl 54, id 32040, offset 0, flags [DF], proto TCP (6), length 52)
    5.75.242.14.9573 > 79.224.127.251.63785: Flags [R.], cksum 0xf2cd (incorrect -> 0x3d1d), seq 2162468965, ack 1715664327, win 23201, options [nop,nop,TS val 4068070622 ecr 3049911999], length 0
1735295417.329892 IP (tos 0x0, ttl 55, id 0, offset 0, flags [none], proto TCP (6), length 52)
    79.224.127.251.59979 > 5.75.242.14.22: Flags [.], cksum 0xa912 (correct), ack 15700, win 2048, options [nop,nop,TS val 4289546733 ecr 4068073418], length 0
1735295417.413483 IP (tos 0x10, ttl 64, id 12617, offset 0, flags [DF], proto TCP (6), length 1096)
    5.75.242.14.22 > 79.224.127.251.59979: Flags [P.], cksum 0xcb6f (incorrect -> 0x0d5e), seq 15700:16744, ack 1, win 501, options [nop,nop,TS val 4068073522 ecr 4289546733], length 1044
1735295417.434403 IP (tos 0x0, ttl 55, id 0, offset 0, flags [none], proto TCP (6), length 52)
    79.224.127.251.59979 > 5.75.242.14.22: Flags [.], cksum 0xa42e (correct), ack 16744, win 2048, options [nop,nop,TS val 4289546837 ecr 4068073522], length 0
1735295417.517483 IP (tos 0x10, ttl 64, id 12618, offset 0, flags [DF], proto TCP (6), length 640)
    5.75.242.14.22 > 79.224.127.251.59979: Flags [P.], cksum 0xc9a7 (incorrect -> 0x503b), seq 16744:17332, ack 1, win 501, options [nop,nop,TS val 4068073626 ecr 4289546837], length 588
1735295417.545891 IP (tos 0x0, ttl 55, id 0, offset 0, flags [none], proto TCP (6), length 52)
    79.224.127.251.59979 > 5.75.242.14.22: Flags [.], cksum 0xa112 (correct), ack 17332, win 2048, options [nop,nop,TS val 4289546941 ecr 4068073626], length 0
1735295417.621429 IP (tos 0x10, ttl 64, id 12619, offset 0, flags [DF], proto TCP (6), length 632)
    5.75.242.14.22 > 79.224.127.251.59979: Flags [P.], cksum 0xc99f (incorrect -> 0x5633), seq 17332:17912, ack 1, win 501, options [nop,nop,TS val 4068073730 ecr 4289546941], length 580
1735295417.642150 IP (tos 0x0, ttl 55, id 0, offset 0, flags [none], proto TCP (6), length 52)
    79.224.127.251.59979 > 5.75.242.14.22: Flags [.], cksum 0x9dfe (correct), ack 17912, win 2048, options [nop,nop,TS val 4289547045 ecr 4068073730], length 0
1735295417.725400 IP (tos 0x10, ttl 64, id 12620, offset 0, flags [DF], proto TCP (6), length 632)
    5.75.242.14.22 > 79.224.127.251.59979: Flags [P.], cksum 0xc99f (incorrect -> 0x8001), seq 17912:18492, ack 1, win 501, options [nop,nop,TS val 4068073834 ecr 4289547045], length 580
1735295417.744978 IP (tos 0x0, ttl 55, id 0, offset 0, flags [none], proto TCP (6), length 52)
    79.224.127.251.59979 > 5.75.242.14.22: Flags [.], cksum 0x9aeb (correct), ack 18492, win 2048, options [nop,nop,TS val 4289547148 ecr 4068073834], length 0
1735295417.829454 IP (tos 0x10, ttl 64, id 12621, offset 0, flags [DF], proto TCP (6), length 632)
    5.75.242.14.22 > 79.224.127.251.59979: Flags [P.], cksum 0xc99f (incorrect -> 0xfac3), seq 18492:19072, ack 1, win 501, options [nop,nop,TS val 4068073938 ecr 4289547148], length 580
1735295417.851425 IP (tos 0x0, ttl 55, id 0, offset 0, flags [none], proto TCP (6), length 52)
    79.224.127.251.59979 > 5.75.242.14.22: Flags [.], cksum 0x97d6 (correct), ack 19072, win 2048, options [nop,nop,TS val 4289547253 ecr 4068073938], length 0
1735295417.933613 IP (tos 0x10, ttl 64, id 12622, offset 0, flags [DF], proto TCP (6), length 632)
    5.75.242.14.22 > 79.224.127.251.59979: Flags [P.], cksum 0xc99f (incorrect -> 0x4dca), seq 19072:19652, ack 1, win 501, options [nop,nop,TS val 4068074042 ecr 4289547253], length 580
1735295417.954502 IP (tos 0x0, ttl 55, id 0, offset 0, flags [none], proto TCP (6), length 52)
    79.224.127.251.59979 > 5.75.242.14.22: Flags [.], cksum 0x94c3 (correct), ack 19652, win 2048, options [nop,nop,TS val 4289547356 ecr 4068074042], length 0
1735295418.037351 IP (tos 0x10, ttl 64, id 12623, offset 0, flags [DF], proto TCP (6), length 632)
    5.75.242.14.22 > 79.224.127.251.59979: Flags [P.], cksum 0xc99f (incorrect -> 0x2313), seq 19652:20232, ack 1, win 501, options [nop,nop,TS val 4068074146 ecr 4289547356], length 580
1735295418.058906 IP (tos 0x0, ttl 55, id 0, offset 0, flags [none], proto TCP (6), length 52)
    79.224.127.251.59979 > 5.75.242.14.22: Flags [.], cksum 0x91ad (correct), ack 20232, win 2048, options [nop,nop,TS val 4289547462 ecr 4068074146], length 0
1735295418.141406 IP (tos 0x10, ttl 64, id 12624, offset 0, flags [DF], proto TCP (6), length 632)
    5.75.242.14.22 > 79.224.127.251.59979: Flags [P.], cksum 0xc99f (incorrect -> 0x5c65), seq 20232:20812, ack 1, win 501, options [nop,nop,TS val 4068074250 ecr 4289547462], length 580
1735295418.167408 IP (tos 0x0, ttl 55, id 0, offset 0, flags [none], proto TCP (6), length 52)
    79.224.127.251.59979 > 5.75.242.14.22: Flags [.], cksum 0x8e96 (correct), ack 20812, win 2048, options [nop,nop,TS val 4289547569 ecr 4068074250], length 0
1735295418.245406 IP (tos 0x10, ttl 64, id 12625, offset 0, flags [DF], proto TCP (6), length 632)
    5.75.242.14.22 > 79.224.127.251.59979: Flags [P.], cksum 0xc99f (incorrect -> 0xf246), seq 20812:21392, ack 1, win 501, options [nop,nop,TS val 4068074354 ecr 4289547569], length 580
1735295418.270668 IP (tos 0x0, ttl 55, id 0, offset 0, flags [none], proto TCP (6), length 52)
    79.224.127.251.59979 > 5.75.242.14.22: Flags [.], cksum 0x8b86 (correct), ack 21392, win 2048, options [nop,nop,TS val 4289547669 ecr 4068074354], length 0
1735295418.349514 IP (tos 0x10, ttl 64, id 12626, offset 0, flags [DF], proto TCP (6), length 632)
    5.75.242.14.22 > 79.224.127.251.59979: Flags [P.], cksum 0xc99f (incorrect -> 0x1513), seq 21392:21972, ack 1, win 501, options [nop,nop,TS val 4068074458 ecr 4289547669], length 580
1735295418.371889 IP (tos 0x0, ttl 55, id 0, offset 0, flags [none], proto TCP (6), length 52)
    79.224.127.251.59979 > 5.75.242.14.22: Flags [.], cksum 0x8870 (correct), ack 21972, win 2048, options [nop,nop,TS val 4289547775 ecr 4068074458], length 0
1735295418.453718 IP (tos 0x10, ttl 64, id 12627, offset 0, flags [DF], proto TCP (6), length 632)
    5.75.242.14.22 > 79.224.127.251.59979: Flags [P.], cksum 0xc99f (incorrect -> 0x0aee), seq 21972:22552, ack 1, win 501, options [nop,nop,TS val 4068074562 ecr 4289547775], length 580
1735295418.474644 IP (tos 0x0, ttl 55, id 0, offset 0, flags [none], proto TCP (6), length 52)
    79.224.127.251.59979 > 5.75.242.14.22: Flags [.], cksum 0x855d (correct), ack 22552, win 2048, options [nop,nop,TS val 4289547878 ecr 4068074562], length 0
1735295418.557443 IP (tos 0x10, ttl 64, id 12628, offset 0, flags [DF], proto TCP (6), length 632)
    5.75.242.14.22 > 79.224.127.251.59979: Flags [P.], cksum 0xc99f (incorrect -> 0x5b75), seq 22552:23132, ack 1, win 501, options [nop,nop,TS val 4068074666 ecr 4289547878], length 580
1735295418.577679 IP (tos 0x0, ttl 55, id 0, offset 0, flags [none], proto TCP (6), length 52)
    79.224.127.251.59979 > 5.75.242.14.22: Flags [.], cksum 0x824a (correct), ack 23132, win 2048, options [nop,nop,TS val 4289547981 ecr 4068074666], length 0
1735295418.661478 IP (tos 0x10, ttl 64, id 12629, offset 0, flags [DF], proto TCP (6), length 632)
    5.75.242.14.22 > 79.224.127.251.59979: Flags [P.], cksum 0xc99f (incorrect -> 0xd315), seq 23132:23712, ack 1, win 501, options [nop,nop,TS val 4068074770 ecr 4289547981], length 580
1735295418.681640 IP (tos 0x0, ttl 55, id 0, offset 0, flags [none], proto TCP (6), length 52)
    79.224.127.251.59979 > 5.75.242.14.22: Flags [.], cksum 0x7f36 (correct), ack 23712, win 2048, options [nop,nop,TS val 4289548085 ecr 4068074770], length 0
1735295418.765558 IP (tos 0x10, ttl 64, id 12630, offset 0, flags [DF], proto TCP (6), length 632)
    5.75.242.14.22 > 79.224.127.251.59979: Flags [P.], cksum 0xc99f (incorrect -> 0xe89f), seq 23712:24292, ack 1, win 501, options [nop,nop,TS val 4068074874 ecr 4289548085], length 580
1735295418.786238 IP (tos 0x0, ttl 55, id 0, offset 0, flags [none], proto TCP (6), length 52)
    79.224.127.251.59979 > 5.75.242.14.22: Flags [.], cksum 0x7c22 (correct), ack 24292, win 2048, options [nop,nop,TS val 4289548189 ecr 4068074874], length 0
1735295418.869421 IP (tos 0x10, ttl 64, id 12631, offset 0, flags [DF], proto TCP (6), length 632)
    5.75.242.14.22 > 79.224.127.251.59979: Flags [P.], cksum 0xc99f (incorrect -> 0x6d22), seq 24292:24872, ack 1, win 501, options [nop,nop,TS val 4068074978 ecr 4289548189], length 580
1735295418.891537 IP (tos 0x0, ttl 55, id 0, offset 0, flags [none], proto TCP (6), length 52)
    79.224.127.251.59979 > 5.75.242.14.22: Flags [.], cksum 0x790d (correct), ack 24872, win 2048, options [nop,nop,TS val 4289548294 ecr 4068074978], length 0
1735295418.973539 IP (tos 0x10, ttl 64, id 12632, offset 0, flags [DF], proto TCP (6), length 632)
    5.75.242.14.22 > 79.224.127.251.59979: Flags [P.], cksum 0xc99f (incorrect -> 0x5560), seq 24872:25452, ack 1, win 501, options [nop,nop,TS val 4068075082 ecr 4289548294], length 580
1735295418.999182 IP (tos 0x0, ttl 55, id 0, offset 0, flags [none], proto TCP (6), length 52)
    79.224.127.251.59979 > 5.75.242.14.22: Flags [.], cksum 0x75f7 (correct), ack 25452, win 2048, options [nop,nop,TS val 4289548400 ecr 4068075082], length 0
1735295419.077504 IP (tos 0x10, ttl 64, id 12633, offset 0, flags [DF], proto TCP (6), length 632)
    5.75.242.14.22 > 79.224.127.251.59979: Flags [P.], cksum 0xc99f (incorrect -> 0xd609), seq 25452:26032, ack 1, win 501, options [nop,nop,TS val 4068075186 ecr 4289548400], length 580
1735295419.097406 IP (tos 0x0, ttl 55, id 0, offset 0, flags [none], proto TCP (6), length 52)
    79.224.127.251.59979 > 5.75.242.14.22: Flags [.], cksum 0x72e6 (correct), ack 26032, win 2048, options [nop,nop,TS val 4289548501 ecr 4068075186], length 0
1735295419.181462 IP (tos 0x10, ttl 64, id 12634, offset 0, flags [DF], proto TCP (6), length 632)
    5.75.242.14.22 > 79.224.127.251.59979: Flags [P.], cksum 0xc99f (incorrect -> 0xdab2), seq 26032:26612, ack 1, win 501, options [nop,nop,TS val 4068075290 ecr 4289548501], length 580
1735295419.201370 IP (tos 0x0, ttl 55, id 0, offset 0, flags [none], proto TCP (6), length 52)
    79.224.127.251.59979 > 5.75.242.14.22: Flags [.], cksum 0x6fd2 (correct), ack 26612, win 2048, options [nop,nop,TS val 4289548605 ecr 4068075290], length 0
1735295419.285489 IP (tos 0x10, ttl 64, id 12635, offset 0, flags [DF], proto TCP (6), length 632)
    5.75.242.14.22 > 79.224.127.251.59979: Flags [P.], cksum 0xc99f (incorrect -> 0xded4), seq 26612:27192, ack 1, win 501, options [nop,nop,TS val 4068075394 ecr 4289548605], length 580
1735295419.305887 IP (tos 0x0, ttl 55, id 0, offset 0, flags [none], proto TCP (6), length 52)
    79.224.127.251.59979 > 5.75.242.14.22: Flags [.], cksum 0x6cbe (correct), ack 27192, win 2048, options [nop,nop,TS val 4289548709 ecr 4068075394], length 0
1735295419.389307 IP (tos 0x10, ttl 64, id 12636, offset 0, flags [DF], proto TCP (6), length 632)
    5.75.242.14.22 > 79.224.127.251.59979: Flags [P.], cksum 0xc99f (incorrect -> 0xd387), seq 27192:27772, ack 1, win 501, options [nop,nop,TS val 4068075498 ecr 4289548709], length 580
1735295419.409646 IP (tos 0x0, ttl 55, id 0, offset 0, flags [none], proto TCP (6), length 52)
    79.224.127.251.59979 > 5.75.242.14.22: Flags [.], cksum 0x69aa (correct), ack 27772, win 2048, options [nop,nop,TS val 4289548813 ecr 4068075498], length 0
1735295419.493480 IP (tos 0x10, ttl 64, id 12637, offset 0, flags [DF], proto TCP (6), length 632)
    5.75.242.14.22 > 79.224.127.251.59979: Flags [P.], cksum 0xc99f (incorrect -> 0xbdd1), seq 27772:28352, ack 1, win 501, options [nop,nop,TS val 4068075602 ecr 4289548813], length 580
1735295419.513684 IP (tos 0x0, ttl 55, id 0, offset 0, flags [none], proto TCP (6), length 52)
    79.224.127.251.59979 > 5.75.242.14.22: Flags [.], cksum 0x6696 (correct), ack 28352, win 2048, options [nop,nop,TS val 4289548917 ecr 4068075602], length 0
1735295419.597681 IP (tos 0x10, ttl 64, id 12638, offset 0, flags [DF], proto TCP (6), length 632)
    5.75.242.14.22 > 79.224.127.251.59979: Flags [P.], cksum 0xc99f (incorrect -> 0xf202), seq 28352:28932, ack 1, win 501, options [nop,nop,TS val 4068075706 ecr 4289548917], length 580
1735295419.618692 IP (tos 0x0, ttl 55, id 0, offset 0, flags [none], proto TCP (6), length 52)
    79.224.127.251.59979 > 5.75.242.14.22: Flags [.], cksum 0x6382 (correct), ack 28932, win 2048, options [nop,nop,TS val 4289549021 ecr 4068075706], length 0
1735295419.701472 IP (tos 0x10, ttl 64, id 12639, offset 0, flags [DF], proto TCP (6), length 632)
    5.75.242.14.22 > 79.224.127.251.59979: Flags [P.], cksum 0xc99f (incorrect -> 0x13c2), seq 28932:29512, ack 1, win 501, options [nop,nop,TS val 4068075810 ecr 4289549021], length 580
1735295419.725672 IP (tos 0x0, ttl 55, id 0, offset 0, flags [none], proto TCP (6), length 52)
    79.224.127.251.59979 > 5.75.242.14.22: Flags [.], cksum 0x606a (correct), ack 29512, win 2048, options [nop,nop,TS val 4289549129 ecr 4068075810], length 0
1735295419.805455 IP (tos 0x10, ttl 64, id 12640, offset 0, flags [DF], proto TCP (6), length 632)
    5.75.242.14.22 > 79.224.127.251.59979: Flags [P.], cksum 0xc99f (incorrect -> 0x3846), seq 29512:30092, ack 1, win 501, options [nop,nop,TS val 4068075914 ecr 4289549129], length 580
1735295419.825983 IP (tos 0x0, ttl 55, id 0, offset 0, flags [none], proto TCP (6), length 52)
    79.224.127.251.59979 > 5.75.242.14.22: Flags [.], cksum 0x5d5a (correct), ack 30092, win 2048, options [nop,nop,TS val 4289549229 ecr 4068075914], length 0
1735295419.909409 IP (tos 0x10, ttl 64, id 12641, offset 0, flags [DF], proto TCP (6), length 632)
    5.75.242.14.22 > 79.224.127.251.59979: Flags [P.], cksum 0xc99f (incorrect -> 0xdb8b), seq 30092:30672, ack 1, win 501, options [nop,nop,TS val 4068076018 ecr 4289549229], length 580
1735295419.935815 IP (tos 0x0, ttl 55, id 0, offset 0, flags [none], proto TCP (6), length 52)
    79.224.127.251.59979 > 5.75.242.14.22: Flags [.], cksum 0x5a47 (correct), ack 30672, win 2048, options [nop,nop,TS val 4289549332 ecr 4068076018], length 0
1735295420.013400 IP (tos 0x10, ttl 64, id 12642, offset 0, flags [DF], proto TCP (6), length 632)
    5.75.242.14.22 > 79.224.127.251.59979: Flags [P.], cksum 0xc99f (incorrect -> 0x62d1), seq 30672:31252, ack 1, win 501, options [nop,nop,TS val 4068076122 ecr 4289549332], length 580
1735295420.033391 IP (tos 0x0, ttl 55, id 0, offset 0, flags [none], proto TCP (6), length 52)
    79.224.127.251.59979 > 5.75.242.14.22: Flags [.], cksum 0x5733 (correct), ack 31252, win 2048, options [nop,nop,TS val 4289549436 ecr 4068076122], length 0
1735295420.117571 IP (tos 0x10, ttl 64, id 12643, offset 0, flags [DF], proto TCP (6), length 632)
    5.75.242.14.22 > 79.224.127.251.59979: Flags [P.], cksum 0xc99f (incorrect -> 0xc96f), seq 31252:31832, ack 1, win 501, options [nop,nop,TS val 4068076226 ecr 4289549436], length 580
1735295420.138451 IP (tos 0x0, ttl 55, id 0, offset 0, flags [none], proto TCP (6), length 52)
    79.224.127.251.59979 > 5.75.242.14.22: Flags [.], cksum 0x541e (correct), ack 31832, win 2048, options [nop,nop,TS val 4289549541 ecr 4068076226], length 0
1735295420.221494 IP (tos 0x10, ttl 64, id 12644, offset 0, flags [DF], proto TCP (6), length 632)
    5.75.242.14.22 > 79.224.127.251.59979: Flags [P.], cksum 0xc99f (incorrect -> 0x75b9), seq 31832:32412, ack 1, win 501, options [nop,nop,TS val 4068076330 ecr 4289549541], length 580
1735295420.243146 IP (tos 0x0, ttl 55, id 0, offset 0, flags [none], proto TCP (6), length 52)
    79.224.127.251.59979 > 5.75.242.14.22: Flags [.], cksum 0x510a (correct), ack 32412, win 2048, options [nop,nop,TS val 4289549645 ecr 4068076330], length 0
1735295420.325378 IP (tos 0x10, ttl 64, id 12645, offset 0, flags [DF], proto TCP (6), length 632)
    5.75.242.14.22 > 79.224.127.251.59979: Flags [P.], cksum 0xc99f (incorrect -> 0xa2cc), seq 32412:32992, ack 1, win 501, options [nop,nop,TS val 4068076434 ecr 4289549645], length 580
1735295420.344651 IP (tos 0x0, ttl 55, id 0, offset 0, flags [none], proto TCP (6), length 52)
    79.224.127.251.59979 > 5.75.242.14.22: Flags [.], cksum 0x4df7 (correct), ack 32992, win 2048, options [nop,nop,TS val 4289549748 ecr 4068076434], length 0
1735295420.430897 IP (tos 0x10, ttl 64, id 12646, offset 0, flags [DF], proto TCP (6), length 632)
    5.75.242.14.22 > 79.224.127.251.59979: Flags [P.], cksum 0xc99f (incorrect -> 0xde55), seq 32992:33572, ack 1, win 501, options [nop,nop,TS val 4068076539 ecr 4289549748], length 580
1735295420.451441 IP (tos 0x0, ttl 55, id 0, offset 0, flags [none], proto TCP (6), length 52)
    79.224.127.251.59979 > 5.75.242.14.22: Flags [.], cksum 0x4adf (correct), ack 33572, win 2048, options [nop,nop,TS val 4289549855 ecr 4068076539], length 0
1735295420.533422 IP (tos 0x10, ttl 64, id 12647, offset 0, flags [DF], proto TCP (6), length 632)
    5.75.242.14.22 > 79.224.127.251.59979: Flags [P.], cksum 0xc99f (incorrect -> 0x2117), seq 33572:34152, ack 1, win 501, options [nop,nop,TS val 4068076642 ecr 4289549855], length 580
1735295420.558896 IP (tos 0x0, ttl 55, id 0, offset 0, flags [none], proto TCP (6), length 52)
    79.224.127.251.59979 > 5.75.242.14.22: Flags [.], cksum 0x47cd (correct), ack 34152, win 2048, options [nop,nop,TS val 4289549958 ecr 4068076642], length 0
1735295420.637580 IP (tos 0x10, ttl 64, id 12648, offset 0, flags [DF], proto TCP (6), length 632)
    5.75.242.14.22 > 79.224.127.251.59979: Flags [P.], cksum 0xc99f (incorrect -> 0x70ae), seq 34152:34732, ack 1, win 501, options [nop,nop,TS val 4068076746 ecr 4289549958], length 580
1735295420.658389 IP (tos 0x0, ttl 55, id 0, offset 0, flags [none], proto TCP (6), length 52)
    79.224.127.251.59979 > 5.75.242.14.22: Flags [.], cksum 0x44ba (correct), ack 34732, win 2048, options [nop,nop,TS val 4289550061 ecr 4068076746], length 0
1735295420.741532 IP (tos 0x10, ttl 64, id 12649, offset 0, flags [DF], proto TCP (6), length 632)
    5.75.242.14.22 > 79.224.127.251.59979: Flags [P.], cksum 0xc99f (incorrect -> 0x4f2e), seq 34732:35312, ack 1, win 501, options [nop,nop,TS val 4068076850 ecr 4289550061], length 580
1735295420.762179 IP (tos 0x0, ttl 55, id 0, offset 0, flags [none], proto TCP (6), length 52)
    79.224.127.251.59979 > 5.75.242.14.22: Flags [.], cksum 0x41a6 (correct), ack 35312, win 2048, options [nop,nop,TS val 4289550165 ecr 4068076850], length 0
1735295420.845447 IP (tos 0x10, ttl 64, id 12650, offset 0, flags [DF], proto TCP (6), length 632)
    5.75.242.14.22 > 79.224.127.251.59979: Flags [P.], cksum 0xc99f (incorrect -> 0x70ec), seq 35312:35892, ack 1, win 501, options [nop,nop,TS val 4068076954 ecr 4289550165], length 580
1735295420.865184 IP (tos 0x0, ttl 55, id 0, offset 0, flags [none], proto TCP (6), length 52)
    79.224.127.251.59979 > 5.75.242.14.22: Flags [.], cksum 0x3e93 (correct), ack 35892, win 2048, options [nop,nop,TS val 4289550268 ecr 4068076954], length 0
1735295420.949422 IP (tos 0x10, ttl 64, id 12651, offset 0, flags [DF], proto TCP (6), length 632)
    5.75.242.14.22 > 79.224.127.251.59979: Flags [P.], cksum 0xc99f (incorrect -> 0xa38c), seq 35892:36472, ack 1, win 501, options [nop,nop,TS val 4068077058 ecr 4289550268], length 580
1735295420.972911 IP (tos 0x0, ttl 55, id 0, offset 0, flags [none], proto TCP (6), length 52)
    79.224.127.251.59979 > 5.75.242.14.22: Flags [.], cksum 0x3b7e (correct), ack 36472, win 2048, options [nop,nop,TS val 4289550373 ecr 4068077058], length 0
1735295421.053480 IP (tos 0x10, ttl 64, id 12652, offset 0, flags [DF], proto TCP (6), length 632)
    5.75.242.14.22 > 79.224.127.251.59979: Flags [P.], cksum 0xc99f (incorrect -> 0x46f9), seq 36472:37052, ack 1, win 501, options [nop,nop,TS val 4068077162 ecr 4289550373], length 580
1735295421.074410 IP (tos 0x0, ttl 55, id 0, offset 0, flags [none], proto TCP (6), length 52)
    79.224.127.251.59979 > 5.75.242.14.22: Flags [.], cksum 0x386a (correct), ack 37052, win 2048, options [nop,nop,TS val 4289550477 ecr 4068077162], length 0
1735295421.157523 IP (tos 0x10, ttl 64, id 12653, offset 0, flags [DF], proto TCP (6), length 632)
    5.75.242.14.22 > 79.224.127.251.59979: Flags [P.], cksum 0xc99f (incorrect -> 0x499e), seq 37052:37632, ack 1, win 501, options [nop,nop,TS val 4068077266 ecr 4289550477], length 580
1735295421.180911 IP (tos 0x0, ttl 55, id 0, offset 0, flags [none], proto TCP (6), length 52)
    79.224.127.251.59979 > 5.75.242.14.22: Flags [.], cksum 0x3554 (correct), ack 37632, win 2048, options [nop,nop,TS val 4289550583 ecr 4068077266], length 0
1735295421.261406 IP (tos 0x10, ttl 64, id 12654, offset 0, flags [DF], proto TCP (6), length 632)
    5.75.242.14.22 > 79.224.127.251.59979: Flags [P.], cksum 0xc99f (incorrect -> 0x5352), seq 37632:38212, ack 1, win 501, options [nop,nop,TS val 4068077370 ecr 4289550583], length 580
1735295421.284151 IP (tos 0x0, ttl 55, id 0, offset 0, flags [none], proto TCP (6), length 52)
    79.224.127.251.59979 > 5.75.242.14.22: Flags [.], cksum 0x3243 (correct), ack 38212, win 2048, options [nop,nop,TS val 4289550684 ecr 4068077370], length 0
1735295421.365505 IP (tos 0x10, ttl 64, id 12655, offset 0, flags [DF], proto TCP (6), length 632)
    5.75.242.14.22 > 79.224.127.251.59979: Flags [P.], cksum 0xc99f (incorrect -> 0x7886), seq 38212:38792, ack 1, win 501, options [nop,nop,TS val 4068077474 ecr 4289550684], length 580
1735295421.387423 IP (tos 0x0, ttl 55, id 0, offset 0, flags [none], proto TCP (6), length 52)
    79.224.127.251.59979 > 5.75.242.14.22: Flags [.], cksum 0x2f2d (correct), ack 38792, win 2048, options [nop,nop,TS val 4289550790 ecr 4068077474], length 0
1735295421.469389 IP (tos 0x10, ttl 64, id 12656, offset 0, flags [DF], proto TCP (6), length 632)
    5.75.242.14.22 > 79.224.127.251.59979: Flags [P.], cksum 0xc99f (incorrect -> 0x7ddb), seq 38792:39372, ack 1, win 501, options [nop,nop,TS val 4068077578 ecr 4289550790], length 580
1735295421.490887 IP (tos 0x0, ttl 55, id 0, offset 0, flags [none], proto TCP (6), length 52)
    79.224.127.251.59979 > 5.75.242.14.22: Flags [.], cksum 0x2c1a (correct), ack 39372, win 2048, options [nop,nop,TS val 4289550893 ecr 4068077578], length 0
1735295421.573427 IP (tos 0x10, ttl 64, id 12657, offset 0, flags [DF], proto TCP (6), length 632)
    5.75.242.14.22 > 79.224.127.251.59979: Flags [P.], cksum 0xc99f (incorrect -> 0xa4d6), seq 39372:39952, ack 1, win 501, options [nop,nop,TS val 4068077682 ecr 4289550893], length 580
1735295421.594173 IP (tos 0x0, ttl 55, id 0, offset 0, flags [none], proto TCP (6), length 52)
    79.224.127.251.59979 > 5.75.242.14.22: Flags [.], cksum 0x2906 (correct), ack 39952, win 2048, options [nop,nop,TS val 4289550997 ecr 4068077682], length 0
1735295421.677385 IP (tos 0x10, ttl 64, id 12658, offset 0, flags [DF], proto TCP (6), length 632)
    5.75.242.14.22 > 79.224.127.251.59979: Flags [P.], cksum 0xc99f (incorrect -> 0xa629), seq 39952:40532, ack 1, win 501, options [nop,nop,TS val 4068077786 ecr 4289550997], length 580
1735295421.698675 IP (tos 0x0, ttl 55, id 0, offset 0, flags [none], proto TCP (6), length 52)
    79.224.127.251.59979 > 5.75.242.14.22: Flags [.], cksum 0x25f2 (correct), ack 40532, win 2048, options [nop,nop,TS val 4289551101 ecr 4068077786], length 0
1735295421.781463 IP (tos 0x10, ttl 64, id 12659, offset 0, flags [DF], proto TCP (6), length 632)
    5.75.242.14.22 > 79.224.127.251.59979: Flags [P.], cksum 0xc99f (incorrect -> 0x2dc8), seq 40532:41112, ack 1, win 501, options [nop,nop,TS val 4068077890 ecr 4289551101], length 580
1735295421.803200 IP (tos 0x0, ttl 55, id 0, offset 0, flags [none], proto TCP (6), length 52)
    79.224.127.251.59979 > 5.75.242.14.22: Flags [.], cksum 0x22de (correct), ack 41112, win 2048, options [nop,nop,TS val 4289551205 ecr 4068077890], length 0
1735295421.885412 IP (tos 0x10, ttl 64, id 12660, offset 0, flags [DF], proto TCP (6), length 632)
    5.75.242.14.22 > 79.224.127.251.59979: Flags [P.], cksum 0xc99f (incorrect -> 0xa062), seq 41112:41692, ack 1, win 501, options [nop,nop,TS val 4068077994 ecr 4289551205], length 580
1735295421.904649 IP (tos 0x0, ttl 55, id 0, offset 0, flags [none], proto TCP (6), length 52)
    79.224.127.251.59979 > 5.75.242.14.22: Flags [.], cksum 0x1fcb (correct), ack 41692, win 2048, options [nop,nop,TS val 4289551308 ecr 4068077994], length 0
1735295421.989557 IP (tos 0x10, ttl 64, id 12661, offset 0, flags [DF], proto TCP (6), length 632)
    5.75.242.14.22 > 79.224.127.251.59979: Flags [P.], cksum 0xc99f (incorrect -> 0xf95e), seq 41692:42272, ack 1, win 501, options [nop,nop,TS val 4068078098 ecr 4289551308], length 580
1735295422.030156 IP (tos 0x0, ttl 55, id 0, offset 0, flags [none], proto TCP (6), length 52)
    79.224.127.251.59979 > 5.75.242.14.22: Flags [.], cksum 0x1cb6 (correct), ack 42272, win 2048, options [nop,nop,TS val 4289551413 ecr 4068078098], length 0
