tcpdump: data link type PKTAP
tcpdump: listening on pktap, link-type PKTAP (Apple DLT_PKTAP), snapshot length 524288 bytes
1735294697.030271 98:9b:cb:71:fb:6e > ff:ff:ff:ff:ff:ff, ethertype Unknown (0x88e1), length 60:
    0x0000:  0000 a000 b052 1cd0 2477 0000 0000 0000  .....R..$w......
    0x0010:  0000 0000 0000 0000 0000 0000 0000 0000  ................
    0x0020:  0000 0000 0000 0000 0000 0000 0000       ..............
1735294697.031172 98:9b:cb:71:fb:6e > ff:ff:ff:ff:ff:ff, ethertype Unknown (0x8912), length 60:
    0x0000:  0170 a000 0000 1f84 d0a3 97a2 5553 bef1  .p..........US..
    0x0010:  fcf9 796b 5214 13e9 e200 0000 0000 0000  ..ykR...........
    0x0020:  0000 0000 0000 0000 0000 0000 0000       ..............
1735294697.293709 IP6 (flowlabel 0x60b00, hlim 255, next-header ICMPv6 (58) payload length: 88) fe80::b0de:28ff:fe27:c164 > ff02::1: [icmp6 sum ok] ICMP6, router advertisement, length 88
    hop limit 64, Flags [none], pref medium, router lifetime 0s, reachable time 0ms, retrans timer 0ms
      source link-address option (1), length 8 (1): b2:de:28:27:c1:64
      mtu option (5), length 8 (1):  1500
      prefix info option (3), length 32 (4): fdf5:dde0:dab0:492e::/64, Flags [onlink, auto], valid time 2592000s, pref. time 604800s
      rdnss option (25), length 24 (3):  lifetime 270s, addr: fe80::b0de:28ff:fe27:c164
1735294698.362022 IP (tos 0x0, ttl 56, id 10787, offset 0, flags [DF], proto TCP (6), length 52)
    172.65.29.85.443 > 192.168.178.40.50417: Flags [.], cksum 0x2989 (correct), ack 2725249523, win 9, options [nop,nop,TS val 341039736 ecr 3723839822], length 0
1735294698.362304 IP (tos 0x0, ttl 64, id 0, offset 0, flags [none], proto TCP (6), length 52)
    192.168.178.40.50417 > 172.65.29.85.443: Flags [.], cksum 0x9854 (correct), ack 1, win 2048, options [nop,nop,TS val 3723855181 ecr 340993974], length 0
1735294699.078396 98:9b:cb:71:fb:6e > ff:ff:ff:ff:ff:ff, ethertype Unknown (0x88e1), length 60:
    0x0000:  0000 a000 b052 1cd0 2477 0000 0000 0000  .....R..$w......
    0x0010:  0000 0000 0000 0000 0000 0000 0000 0000  ................
    0x0020:  0000 0000 0000 0000 0000 0000 0000       ..............
1735294699.079178 98:9b:cb:71:fb:6e > ff:ff:ff:ff:ff:ff, ethertype Unknown (0x8912), length 60:
    0x0000:  0170 a000 0000 1f84 d0a3 97a2 5553 bef1  .p..........US..
    0x0010:  fcf9 796b 5214 13e9 e200 0000 0000 0000  ..ykR...........
    0x0020:  0000 0000 0000 0000 0000 0000 0000       ..............
1735294699.391395 IP (tos 0x0, ttl 64, id 2648, offset 0, flags [none], proto TCP (6), length 40)
    192.168.178.40.50352 > 140.82.112.26.443: Flags [.], cksum 0xdc27 (correct), ack 2106370678, win 2048, length 0
1735294699.507233 IP (tos 0x0, ttl 52, id 58150, offset 0, flags [DF], proto TCP (6), length 52)
    140.82.112.26.443 > 192.168.178.40.50352: Flags [.], cksum 0x743d (correct), ack 1, win 90, options [nop,nop,TS val 1730674819 ecr 1008702125], length 0
1735294700.409893 IP (tos 0x0, ttl 54, id 54616, offset 0, flags [DF], proto TCP (6), length 76)
    49.12.98.128.443 > 192.168.178.40.50421: Flags [P.], cksum 0xfc5a (correct), seq 3399036166:3399036190, ack 2992730482, win 501, options [nop,nop,TS val 1201963157 ecr 2234021445], length 24
1735294700.409896 IP (tos 0x0, ttl 54, id 54617, offset 0, flags [DF], proto TCP (6), length 52)
    49.12.98.128.443 > 192.168.178.40.50421: Flags [F.], cksum 0xc885 (correct), seq 24, ack 1, win 501, options [nop,nop,TS val 1201963157 ecr 2234021445], length 0
1735294700.410190 IP (tos 0x0, ttl 64, id 0, offset 0, flags [none], proto TCP (6), length 52)
    192.168.178.40.50421 > 49.12.98.128.443: Flags [.], cksum 0xaecb (correct), ack 24, win 2047, options [nop,nop,TS val 2234026486 ecr 1201963157], length 0
1735294700.410393 IP (tos 0x0, ttl 64, id 0, offset 0, flags [none], proto TCP (6), length 52)
    192.168.178.40.50421 > 49.12.98.128.443: Flags [.], cksum 0xaeca (correct), ack 25, win 2047, options [nop,nop,TS val 2234026486 ecr 1201963157], length 0
1735294700.410894 IP (tos 0x0, ttl 64, id 0, offset 0, flags [none], proto TCP (6), length 52)
    192.168.178.40.50421 > 49.12.98.128.443: Flags [F.], cksum 0xaec8 (correct), seq 1, ack 25, win 2048, options [nop,nop,TS val 2234026486 ecr 1201963157], length 0
1735294700.427694 IP (tos 0x0, ttl 54, id 54618, offset 0, flags [DF], proto TCP (6), length 52)
    49.12.98.128.443 > 192.168.178.40.50421: Flags [F.], cksum 0xc84f (correct), seq 24, ack 1, win 501, options [nop,nop,TS val 1201963211 ecr 2234021445], length 0
1735294700.427902 IP (tos 0x0, ttl 64, id 0, offset 0, flags [none], proto TCP (6), length 52)
    192.168.178.40.50421 > 49.12.98.128.443: Flags [F.], cksum 0xaeb6 (correct), seq 1, ack 25, win 2048, options [nop,nop,TS val 2234026504 ecr 1201963157], length 0
1735294700.429979 IP (tos 0x0, ttl 54, id 54619, offset 0, flags [DF], proto TCP (6), length 52)
    49.12.98.128.443 > 192.168.178.40.50421: Flags [.], cksum 0xb49b (correct), ack 2, win 501, options [nop,nop,TS val 1201963213 ecr 2234026486], length 0
1735294700.447391 IP (tos 0x0, ttl 54, id 0, offset 0, flags [DF], proto TCP (6), length 52)
    49.12.98.128.443 > 192.168.178.40.50421: Flags [.], cksum 0xb489 (correct), ack 2, win 501, options [nop,nop,TS val 1201963231 ecr 2234026486], length 0
1735294700.479123 IP (tos 0x0, ttl 64, id 0, offset 0, flags [none], proto TCP (6), length 583)
    192.168.178.40.50080 > 185.70.42.41.443: Flags [P.], cksum 0x4a20 (correct), seq 1846351351:1846351882, ack 3674771079, win 19825, options [nop,nop,TS val 240798847 ecr 1921726068], length 531
1735294700.503729 IP (tos 0x0, ttl 57, id 5453, offset 0, flags [DF], proto TCP (6), length 52)
    185.70.42.41.443 > 192.168.178.40.50080: Flags [.], cksum 0x4b5f (correct), ack 531, win 83, options [nop,nop,TS val 1921733218 ecr 240798847], length 0
1735294700.602920 IP (tos 0x0, ttl 57, id 5454, offset 0, flags [DF], proto TCP (6), length 1280)
    185.70.42.41.443 > 192.168.178.40.50080: Flags [.], cksum 0x925c (correct), seq 1:1229, ack 531, win 83, options [nop,nop,TS val 1921733318 ecr 240798847], length 1228
1735294700.602923 IP (tos 0x0, ttl 57, id 5455, offset 0, flags [DF], proto TCP (6), length 461)
    185.70.42.41.443 > 192.168.178.40.50080: Flags [P.], cksum 0x09cb (correct), seq 1229:1638, ack 531, win 83, options [nop,nop,TS val 1921733318 ecr 240798847], length 409
1735294700.603160 IP (tos 0x0, ttl 64, id 0, offset 0, flags [none], proto TCP (6), length 52)
    192.168.178.40.50080 > 185.70.42.41.443: Flags [.], cksum 0xf714 (correct), ack 1638, win 19800, options [nop,nop,TS val 240798971 ecr 1921733318], length 0
1735294701.023979 98:9b:cb:71:fb:6e > ff:ff:ff:ff:ff:ff, ethertype Unknown (0x88e1), length 60:
    0x0000:  0000 a000 b052 1cd0 2477 0000 0000 0000  .....R..$w......
    0x0010:  0000 0000 0000 0000 0000 0000 0000 0000  ................
    0x0020:  0000 0000 0000 0000 0000 0000 0000       ..............
1735294701.026355 98:9b:cb:71:fb:6e > ff:ff:ff:ff:ff:ff, ethertype Unknown (0x8912), length 60:
    0x0000:  0170 a000 0000 1f84 d0a3 97a2 5553 bef1  .p..........US..
    0x0010:  fcf9 796b 5214 13e9 e200 0000 0000 0000  ..ykR...........
    0x0020:  0000 0000 0000 0000 0000 0000 0000       ..............
1735294701.152662 IP (tos 0x0, ttl 64, id 0, offset 0, flags [none], proto TCP (6), length 64)
    192.168.178.40.50422 > 49.12.98.128.443: Flags [S], cksum 0x9710 (correct), seq 2498642107, win 65535, options [mss 1460,nop,wscale 6,nop,nop,TS val 1309060908 ecr 0,sackOK,eol], length 0
1735294701.153335 IP (tos 0x0, ttl 64, id 0, offset 0, flags [none], proto TCP (6), length 64)
    192.168.178.40.50423 > 49.12.98.128.443: Flags [S], cksum 0xc522 (correct), seq 3655835310, win 65535, options [mss 1460,nop,wscale 6,nop,nop,TS val 2913435275 ecr 0,sackOK,eol], length 0
1735294701.174581 IP (tos 0x0, ttl 54, id 0, offset 0, flags [DF], proto TCP (6), length 60)
    49.12.98.128.443 > 192.168.178.40.50422: Flags [S.], cksum 0x1df0 (correct), seq 2610767003, ack 2498642108, win 65160, options [mss 1452,sackOK,TS val 1201963957 ecr 1309060908,nop,wscale 7], length 0
1735294701.174605 IP (tos 0x0, ttl 54, id 0, offset 0, flags [DF], proto TCP (6), length 60)
    49.12.98.128.443 > 192.168.178.40.50423: Flags [S.], cksum 0x8efa (correct), seq 3390485289, ack 3655835311, win 65160, options [mss 1452,sackOK,TS val 1201963957 ecr 2913435275,nop,wscale 7], length 0
1735294701.174809 IP (tos 0x0, ttl 64, id 0, offset 0, flags [none], proto TCP (6), length 52)
    192.168.178.40.50422 > 49.12.98.128.443: Flags [.], cksum 0x4310 (correct), ack 1, win 2070, options [nop,nop,TS val 1309060931 ecr 1201963957], length 0
1735294701.174917 IP (tos 0x0, ttl 64, id 0, offset 0, flags [none], proto TCP (6), length 52)
    192.168.178.40.50423 > 49.12.98.128.443: Flags [.], cksum 0xb41b (correct), ack 1, win 2070, options [nop,nop,TS val 2913435297 ecr 1201963957], length 0
1735294701.175919 IP (tos 0x0, ttl 64, id 0, offset 0, flags [none], proto TCP (6), length 569)
    192.168.178.40.50423 > 49.12.98.128.443: Flags [P.], cksum 0xb97a (correct), seq 1:518, ack 1, win 2070, options [nop,nop,TS val 2913435298 ecr 1201963957], length 517
1735294701.175955 IP (tos 0x0, ttl 64, id 0, offset 0, flags [none], proto TCP (6), length 569)
    192.168.178.40.50422 > 49.12.98.128.443: Flags [P.], cksum 0x2495 (correct), seq 1:518, ack 1, win 2070, options [nop,nop,TS val 1309060932 ecr 1201963957], length 517
1735294701.195607 IP (tos 0x0, ttl 54, id 42637, offset 0, flags [DF], proto TCP (6), length 52)
    49.12.98.128.443 > 192.168.178.40.50423: Flags [.], cksum 0xb81b (correct), ack 518, win 506, options [nop,nop,TS val 1201963979 ecr 2913435298], length 0
1735294701.195642 IP (tos 0x0, ttl 54, id 25194, offset 0, flags [DF], proto TCP (6), length 52)
    49.12.98.128.443 > 192.168.178.40.50422: Flags [.], cksum 0x4710 (correct), ack 518, win 506, options [nop,nop,TS val 1201963979 ecr 1309060932], length 0
1735294701.198306 IP (tos 0x0, ttl 54, id 42638, offset 0, flags [DF], proto TCP (6), length 1492)
    49.12.98.128.443 > 192.168.178.40.50423: Flags [.], cksum 0x7971 (correct), seq 1:1441, ack 518, win 506, options [nop,nop,TS val 1201963981 ecr 2913435298], length 1440
1735294701.198307 IP (tos 0x0, ttl 54, id 42639, offset 0, flags [DF], proto TCP (6), length 1492)
    49.12.98.128.443 > 192.168.178.40.50423: Flags [P.], cksum 0x1826 (correct), seq 1441:2881, ack 518, win 506, options [nop,nop,TS val 1201963981 ecr 2913435298], length 1440
1735294701.198308 IP (tos 0x0, ttl 54, id 42640, offset 0, flags [DF], proto TCP (6), length 319)
    49.12.98.128.443 > 192.168.178.40.50423: Flags [P.], cksum 0x4e27 (correct), seq 2881:3148, ack 518, win 506, options [nop,nop,TS val 1201963981 ecr 2913435298], length 267
1735294701.198395 IP (tos 0x0, ttl 64, id 0, offset 0, flags [none], proto TCP (6), length 52)
    192.168.178.40.50423 > 49.12.98.128.443: Flags [.], cksum 0xa5cd (correct), ack 3148, win 2020, options [nop,nop,TS val 2913435321 ecr 1201963981], length 0
1735294701.201233 IP (tos 0x0, ttl 54, id 25195, offset 0, flags [DF], proto TCP (6), length 1492)
    49.12.98.128.443 > 192.168.178.40.50422: Flags [.], cksum 0xa41e (correct), seq 1:1441, ack 518, win 506, options [nop,nop,TS val 1201963984 ecr 1309060932], length 1440
1735294701.201237 IP (tos 0x0, ttl 54, id 25196, offset 0, flags [DF], proto TCP (6), length 1492)
    49.12.98.128.443 > 192.168.178.40.50422: Flags [P.], cksum 0x717c (correct), seq 1441:2881, ack 518, win 506, options [nop,nop,TS val 1201963984 ecr 1309060932], length 1440
1735294701.201239 IP (tos 0x0, ttl 54, id 25197, offset 0, flags [DF], proto TCP (6), length 319)
    49.12.98.128.443 > 192.168.178.40.50422: Flags [P.], cksum 0x499c (correct), seq 2881:3148, ack 518, win 506, options [nop,nop,TS val 1201963984 ecr 1309060932], length 267
1735294701.201413 IP (tos 0x0, ttl 64, id 0, offset 0, flags [none], proto TCP (6), length 52)
    192.168.178.40.50422 > 49.12.98.128.443: Flags [.], cksum 0x34bd (correct), ack 3148, win 2020, options [nop,nop,TS val 1309060957 ecr 1201963984], length 0
1735294701.203583 IP (tos 0x0, ttl 64, id 0, offset 0, flags [none], proto TCP (6), length 132)
    192.168.178.40.50423 > 49.12.98.128.443: Flags [P.], cksum 0xae36 (correct), seq 518:598, ack 3148, win 2048, options [nop,nop,TS val 2913435326 ecr 1201963981], length 80
1735294701.205745 IP (tos 0x0, ttl 64, id 0, offset 0, flags [none], proto TCP (6), length 132)
    192.168.178.40.50422 > 49.12.98.128.443: Flags [P.], cksum 0x278e (correct), seq 518:598, ack 3148, win 2048, options [nop,nop,TS val 1309060962 ecr 1201963984], length 80
1735294701.223432 IP (tos 0x0, ttl 54, id 42641, offset 0, flags [DF], proto TCP (6), length 131)
    49.12.98.128.443 > 192.168.178.40.50423: Flags [P.], cksum 0x36b7 (correct), seq 3148:3227, ack 598, win 506, options [nop,nop,TS val 1201964005 ecr 2913435326], length 79
1735294701.223435 IP (tos 0x0, ttl 54, id 42642, offset 0, flags [DF], proto TCP (6), length 131)
    49.12.98.128.443 > 192.168.178.40.50423: Flags [P.], cksum 0x3189 (correct), seq 3227:3306, ack 598, win 506, options [nop,nop,TS val 1201964005 ecr 2913435326], length 79
1735294701.223723 IP (tos 0x0, ttl 64, id 0, offset 0, flags [none], proto TCP (6), length 965)
    192.168.178.40.50423 > 49.12.98.128.443: Flags [P.], cksum 0x87d5 (correct), seq 598:1511, ack 3306, win 2045, options [nop,nop,TS val 2913435346 ecr 1201964005], length 913
1735294701.224572 IP (tos 0x0, ttl 54, id 25198, offset 0, flags [DF], proto TCP (6), length 131)
    49.12.98.128.443 > 192.168.178.40.50422: Flags [P.], cksum 0xacf1 (correct), seq 3148:3227, ack 598, win 506, options [nop,nop,TS val 1201964007 ecr 1309060962], length 79
1735294701.224573 IP (tos 0x0, ttl 54, id 25199, offset 0, flags [DF], proto TCP (6), length 131)
    49.12.98.128.443 > 192.168.178.40.50422: Flags [P.], cksum 0xf2b0 (correct), seq 3227:3306, ack 598, win 506, options [nop,nop,TS val 1201964008 ecr 1309060962], length 79
1735294701.224646 IP (tos 0x0, ttl 64, id 0, offset 0, flags [none], proto TCP (6), length 1036)
    192.168.178.40.50422 > 49.12.98.128.443: Flags [P.], cksum 0x7ba4 (correct), seq 598:1582, ack 3306, win 2045, options [nop,nop,TS val 1309060981 ecr 1201964008], length 984
1735294701.282959 IP (tos 0x0, ttl 54, id 42643, offset 0, flags [DF], proto TCP (6), length 52)
    49.12.98.128.443 > 192.168.178.40.50423: Flags [.], cksum 0xa6ce (correct), ack 1511, win 501, options [nop,nop,TS val 1201964067 ecr 2913435346], length 0
1735294701.286964 IP (tos 0x0, ttl 54, id 25200, offset 0, flags [DF], proto TCP (6), length 52)
    49.12.98.128.443 > 192.168.178.40.50422: Flags [.], cksum 0x3577 (correct), ack 1582, win 501, options [nop,nop,TS val 1201964071 ecr 1309060981], length 0
1735294701.430513 IP (tos 0x0, ttl 54, id 42644, offset 0, flags [DF], proto TCP (6), length 875)
    49.12.98.128.443 > 192.168.178.40.50423: Flags [P.], cksum 0x36ed (correct), seq 3306:4129, ack 1511, win 501, options [nop,nop,TS val 1201964213 ecr 2913435346], length 823
1735294701.430735 IP (tos 0x0, ttl 64, id 0, offset 0, flags [none], proto TCP (6), length 52)
    192.168.178.40.50423 > 49.12.98.128.443: Flags [.], cksum 0x9c38 (correct), ack 4129, win 2035, options [nop,nop,TS val 2913435553 ecr 1201964213], length 0
1735294701.433018 IP (tos 0x0, ttl 54, id 25201, offset 0, flags [DF], proto TCP (6), length 1131)
    49.12.98.128.443 > 192.168.178.40.50422: Flags [P.], cksum 0xd018 (correct), seq 3306:4385, ack 1582, win 501, options [nop,nop,TS val 1201964217 ecr 1309060981], length 1079
1735294701.433065 IP (tos 0x0, ttl 64, id 0, offset 0, flags [none], proto TCP (6), length 52)
    192.168.178.40.50422 > 49.12.98.128.443: Flags [.], cksum 0x29e4 (correct), ack 4385, win 2031, options [nop,nop,TS val 1309061189 ecr 1201964217], length 0
1735294703.071879 98:9b:cb:71:fb:6e > ff:ff:ff:ff:ff:ff, ethertype Unknown (0x88e1), length 60:
    0x0000:  0000 a000 b052 1cd0 2477 0000 0000 0000  .....R..$w......
    0x0010:  0000 0000 0000 0000 0000 0000 0000 0000  ................
    0x0020:  0000 0000 0000 0000 0000 0000 0000       ..............
1735294703.074401 98:9b:cb:71:fb:6e > ff:ff:ff:ff:ff:ff, ethertype Unknown (0x8912), length 60:
    0x0000:  0170 a000 0000 1f84 d0a3 97a2 5553 bef1  .p..........US..
    0x0010:  fcf9 796b 5214 13e9 e200 0000 0000 0000  ..ykR...........
    0x0020:  0000 0000 0000 0000 0000 0000 0000       ..............
1735294703.077697 IP (tos 0x0, ttl 60, id 7539, offset 0, flags [none], proto TCP (6), length 139)
    172.217.16.74.443 > 192.168.178.40.50124: Flags [P.], cksum 0xcf9b (correct), seq 4227799434:4227799521, ack 2460698506, win 1050, options [nop,nop,TS val 2346721042 ecr 465949174], length 87
1735294703.078076 IP (tos 0x0, ttl 64, id 0, offset 0, flags [none], proto TCP (6), length 52)
    192.168.178.40.50124 > 172.217.16.74.443: Flags [.], cksum 0x7b46 (correct), ack 87, win 2048, options [nop,nop,TS val 465979179 ecr 2346721042], length 0
1735294703.164521 IP (tos 0x0, ttl 64, id 11238, offset 0, flags [none], proto UDP (17), length 65)
    192.168.178.40.60933 > 192.168.178.21.53: 23240+ Type65? init.push.apple.com. (37)
1735294703.167427 IP (tos 0x0, ttl 64, id 18387, offset 0, flags [DF], proto UDP (17), length 65)
    192.168.178.21.53 > 192.168.178.40.60933: 23240 0/0/0 (37)
1735294703.176932 IP (tos 0x0, ttl 64, id 54510, offset 0, flags [none], proto UDP (17), length 60)
    192.168.178.40.54453 > 192.168.178.21.53: 49369+ TXT? push.apple.com. (32)
1735294703.179978 IP (tos 0x0, ttl 64, id 18388, offset 0, flags [DF], proto UDP (17), length 60)
    192.168.178.21.53 > 192.168.178.40.54453: 49369 0/0/0 (32)
1735294705.017548 98:9b:cb:71:fb:6e > ff:ff:ff:ff:ff:ff, ethertype Unknown (0x88e1), length 60:
    0x0000:  0000 a000 b052 1cd0 2477 0000 0000 0000  .....R..$w......
    0x0010:  0000 0000 0000 0000 0000 0000 0000 0000  ................
    0x0020:  0000 0000 0000 0000 0000 0000 0000       ..............
1735294705.018374 98:9b:cb:71:fb:6e > ff:ff:ff:ff:ff:ff, ethertype Unknown (0x8912), length 60:
    0x0000:  0170 a000 0000 1f84 d0a3 97a2 5553 bef1  .p..........US..
    0x0010:  fcf9 796b 5214 13e9 e200 0000 0000 0000  ..ykR...........
    0x0020:  0000 0000 0000 0000 0000 0000 0000       ..............
1735294706.453794 ARP, Ethernet (len 6), IPv4 (len 4), Request who-has 192.168.178.40 tell 192.168.178.1, length 28
1735294706.453848 ARP, Ethernet (len 6), IPv4 (len 4), Reply 192.168.178.40 is-at b0:de:28:72:17:b0, length 28
1735294706.464094 IP (tos 0x0, ttl 54, id 42645, offset 0, flags [DF], proto TCP (6), length 76)
    49.12.98.128.443 > 192.168.178.40.50423: Flags [P.], cksum 0x58d1 (correct), seq 4129:4153, ack 1511, win 501, options [nop,nop,TS val 1201969219 ecr 2913435553], length 24
1735294706.464097 IP (tos 0x0, ttl 54, id 42646, offset 0, flags [DF], proto TCP (6), length 52)
    49.12.98.128.443 > 192.168.178.40.50423: Flags [F.], cksum 0x8e8f (correct), seq 4153, ack 1511, win 501, options [nop,nop,TS val 1201969219 ecr 2913435553], length 0
1735294706.464117 IP (tos 0x0, ttl 54, id 25202, offset 0, flags [DF], proto TCP (6), length 76)
    49.12.98.128.443 > 192.168.178.40.50422: Flags [P.], cksum 0x74f2 (correct), seq 4385:4409, ack 1582, win 501, options [nop,nop,TS val 1201969219 ecr 1309061189], length 24
1735294706.464117 IP (tos 0x0, ttl 54, id 25203, offset 0, flags [DF], proto TCP (6), length 52)
    49.12.98.128.443 > 192.168.178.40.50422: Flags [F.], cksum 0x1c3b (correct), seq 4409, ack 1582, win 501, options [nop,nop,TS val 1201969219 ecr 1309061189], length 0
1735294706.464326 IP (tos 0x0, ttl 64, id 0, offset 0, flags [none], proto TCP (6), length 52)
    192.168.178.40.50423 > 49.12.98.128.443: Flags [.], cksum 0x74dd (correct), ack 4153, win 2047, options [nop,nop,TS val 2913440586 ecr 1201969219], length 0
1735294706.464483 IP (tos 0x0, ttl 64, id 0, offset 0, flags [none], proto TCP (6), length 52)
    192.168.178.40.50423 > 49.12.98.128.443: Flags [.], cksum 0x74dc (correct), ack 4154, win 2047, options [nop,nop,TS val 2913440586 ecr 1201969219], length 0
1735294706.464527 IP (tos 0x0, ttl 64, id 0, offset 0, flags [none], proto TCP (6), length 52)
    192.168.178.40.50422 > 49.12.98.128.443: Flags [.], cksum 0x028b (correct), ack 4409, win 2047, options [nop,nop,TS val 1309066220 ecr 1201969219], length 0
1735294706.464567 IP (tos 0x0, ttl 64, id 0, offset 0, flags [none], proto TCP (6), length 52)
    192.168.178.40.50422 > 49.12.98.128.443: Flags [.], cksum 0x028a (correct), ack 4410, win 2047, options [nop,nop,TS val 1309066220 ecr 1201969219], length 0
1735294706.465041 IP (tos 0x0, ttl 64, id 0, offset 0, flags [none], proto TCP (6), length 52)
    192.168.178.40.50423 > 49.12.98.128.443: Flags [F.], cksum 0x74da (correct), seq 1511, ack 4154, win 2048, options [nop,nop,TS val 2913440586 ecr 1201969219], length 0
1735294706.466405 IP (tos 0x0, ttl 64, id 0, offset 0, flags [none], proto TCP (6), length 52)
    192.168.178.40.50422 > 49.12.98.128.443: Flags [F.], cksum 0x0285 (correct), seq 1582, ack 4410, win 2048, options [nop,nop,TS val 1309066223 ecr 1201969219], length 0
1735294706.483880 IP (tos 0x0, ttl 54, id 25204, offset 0, flags [DF], proto TCP (6), length 52)
    49.12.98.128.443 > 192.168.178.40.50422: Flags [F.], cksum 0x1c0b (correct), seq 4409, ack 1582, win 501, options [nop,nop,TS val 1201969267 ecr 1309061189], length 0
1735294706.483903 IP (tos 0x0, ttl 54, id 42647, offset 0, flags [DF], proto TCP (6), length 52)
    49.12.98.128.443 > 192.168.178.40.50423: Flags [F.], cksum 0x8e5f (correct), seq 4153, ack 1511, win 501, options [nop,nop,TS val 1201969267 ecr 2913435553], length 0
1735294706.484093 IP (tos 0x0, ttl 64, id 0, offset 0, flags [none], proto TCP (6), length 52)
    192.168.178.40.50422 > 49.12.98.128.443: Flags [F.], cksum 0x0274 (correct), seq 1582, ack 4410, win 2048, options [nop,nop,TS val 1309066240 ecr 1201969219], length 0
1735294706.484233 IP (tos 0x0, ttl 64, id 0, offset 0, flags [none], proto TCP (6), length 52)
    192.168.178.40.50423 > 49.12.98.128.443: Flags [F.], cksum 0x74c6 (correct), seq 1511, ack 4154, win 2048, options [nop,nop,TS val 2913440606 ecr 1201969219], length 0
1735294706.485101 IP (tos 0x0, ttl 54, id 42648, offset 0, flags [DF], proto TCP (6), length 52)
    49.12.98.128.443 > 192.168.178.40.50423: Flags [.], cksum 0x7ab3 (correct), ack 1512, win 501, options [nop,nop,TS val 1201969269 ecr 2913440586], length 0
1735294706.486378 IP (tos 0x0, ttl 54, id 25205, offset 0, flags [DF], proto TCP (6), length 52)
    49.12.98.128.443 > 192.168.178.40.50422: Flags [.], cksum 0x085e (correct), ack 1583, win 501, options [nop,nop,TS val 1201969269 ecr 1309066223], length 0
1735294706.504242 IP (tos 0x0, ttl 54, id 0, offset 0, flags [DF], proto TCP (6), length 52)
    49.12.98.128.443 > 192.168.178.40.50422: Flags [.], cksum 0x084c (correct), ack 1583, win 501, options [nop,nop,TS val 1201969287 ecr 1309066223], length 0
1735294706.504248 IP (tos 0x0, ttl 54, id 0, offset 0, flags [DF], proto TCP (6), length 52)
    49.12.98.128.443 > 192.168.178.40.50423: Flags [.], cksum 0x7aa1 (correct), ack 1512, win 501, options [nop,nop,TS val 1201969287 ecr 2913440586], length 0
1735294707.054781 IP (tos 0x0, ttl 64, id 7192, offset 0, flags [none], proto UDP (17), length 61)
    192.168.178.40.62504 > 192.168.178.21.53: 18561+ A? www.booking.com. (33)
1735294707.060165 98:9b:cb:71:fb:6e > ff:ff:ff:ff:ff:ff, ethertype Unknown (0x88e1), length 60:
    0x0000:  0000 a000 b052 1cd0 2477 0000 0000 0000  .....R..$w......
    0x0010:  0000 0000 0000 0000 0000 0000 0000 0000  ................
    0x0020:  0000 0000 0000 0000 0000 0000 0000       ..............
1735294707.061526 98:9b:cb:71:fb:6e > ff:ff:ff:ff:ff:ff, ethertype Unknown (0x8912), length 60:
    0x0000:  0170 a000 0000 1f84 d0a3 97a2 5553 bef1  .p..........US..
    0x0010:  fcf9 796b 5214 13e9 e200 0000 0000 0000  ..ykR...........
    0x0020:  0000 0000 0000 0000 0000 0000 0000       ..............
1735294707.068646 IP (tos 0x0, ttl 64, id 59670, offset 0, flags [none], proto UDP (17), length 61)
    192.168.178.40.60482 > 192.168.178.21.53: 55096+ Type65? www.booking.com. (33)
1735294707.072714 IP (tos 0x0, ttl 64, id 0, offset 0, flags [none], proto TCP (6), length 641)
    192.168.178.40.50416 > 18.66.2.100.443: Flags [P.], cksum 0x59db (correct), seq 2781689357:2781689946, ack 1166480406, win 7135, options [nop,nop,TS val 2832574554 ecr 3493965771], length 589
1735294707.072766 IP (tos 0x0, ttl 64, id 0, offset 0, flags [none], proto TCP (6), length 91)
    192.168.178.40.50416 > 18.66.2.100.443: Flags [P.], cksum 0x4ef6 (correct), seq 589:628, ack 1, win 7135, options [nop,nop,TS val 2832574554 ecr 3493965771], length 39
1735294707.082104 IP (tos 0x0, ttl 250, id 30755, offset 0, flags [none], proto TCP (6), length 52)
    18.66.2.100.443 > 192.168.178.40.50416: Flags [.], cksum 0xecd8 (correct), ack 589, win 156, options [nop,nop,TS val 3493978606 ecr 2832574554], length 0
1735294707.082105 IP (tos 0x0, ttl 250, id 30756, offset 0, flags [none], proto TCP (6), length 52)
    18.66.2.100.443 > 192.168.178.40.50416: Flags [.], cksum 0xecb1 (correct), ack 628, win 156, options [nop,nop,TS val 3493978606 ecr 2832574554], length 0
1735294707.082106 IP (tos 0x0, ttl 250, id 30757, offset 0, flags [none], proto TCP (6), length 91)
    18.66.2.100.443 > 192.168.178.40.50416: Flags [P.], cksum 0xf14f (correct), seq 1:40, ack 628, win 156, options [nop,nop,TS val 3493978606 ecr 2832574554], length 39
1735294707.082310 IP (tos 0x0, ttl 64, id 0, offset 0, flags [none], proto TCP (6), length 52)
    192.168.178.40.50416 > 18.66.2.100.443: Flags [.], cksum 0xd13f (correct), ack 40, win 7134, options [nop,nop,TS val 2832574563 ecr 3493978606], length 0
1735294707.086251 IP (tos 0x0, ttl 64, id 18744, offset 0, flags [DF], proto UDP (17), length 188)
    192.168.178.21.53 > 192.168.178.40.60482: 55096 1/1/0 www.booking.com. CNAME d1of1hbywxxm65.cloudfront.net. (160)
1735294707.089371 IP (tos 0x0, ttl 64, id 18745, offset 0, flags [DF], proto UDP (17), length 168)
    192.168.178.21.53 > 192.168.178.40.62504: 18561 5/0/0 www.booking.com. CNAME d1of1hbywxxm65.cloudfront.net., d1of1hbywxxm65.cloudfront.net. A 18.66.2.89, d1of1hbywxxm65.cloudfront.net. A 18.66.2.100, d1of1hbywxxm65.cloudfront.net. A 18.66.2.55, d1of1hbywxxm65.cloudfront.net. A 18.66.2.81 (140)
1735294707.989552 IP (tos 0x0, ttl 250, id 30758, offset 0, flags [none], proto TCP (6), length 1480)
    18.66.2.100.443 > 192.168.178.40.50416: Flags [.], cksum 0x1603 (correct), seq 40:1468, ack 628, win 156, options [nop,nop,TS val 3493979503 ecr 2832574563], length 1428
1735294707.989557 IP (tos 0x0, ttl 250, id 30759, offset 0, flags [none], proto TCP (6), length 1480)
    18.66.2.100.443 > 192.168.178.40.50416: Flags [.], cksum 0x74ff (correct), seq 1468:2896, ack 628, win 156, options [nop,nop,TS val 3493979503 ecr 2832574563], length 1428
1735294707.989559 IP (tos 0x0, ttl 250, id 30760, offset 0, flags [none], proto TCP (6), length 1480)
    18.66.2.100.443 > 192.168.178.40.50416: Flags [.], cksum 0xaa73 (correct), seq 2896:4324, ack 628, win 156, options [nop,nop,TS val 3493979503 ecr 2832574563], length 1428
1735294707.989561 IP (tos 0x0, ttl 250, id 30761, offset 0, flags [none], proto TCP (6), length 1480)
    18.66.2.100.443 > 192.168.178.40.50416: Flags [.], cksum 0xe7b1 (correct), seq 4324:5752, ack 628, win 156, options [nop,nop,TS val 3493979503 ecr 2832574563], length 1428
1735294707.989563 IP (tos 0x0, ttl 250, id 30762, offset 0, flags [none], proto TCP (6), length 1088)
    18.66.2.100.443 > 192.168.178.40.50416: Flags [P.], cksum 0x4470 (correct), seq 5752:6788, ack 628, win 156, options [nop,nop,TS val 3493979503 ecr 2832574563], length 1036
1735294707.989839 IP (tos 0x0, ttl 64, id 0, offset 0, flags [none], proto TCP (6), length 52)
    192.168.178.40.50416 > 18.66.2.100.443: Flags [.], cksum 0xb03f (correct), ack 6788, win 7029, options [nop,nop,TS val 2832575471 ecr 3493979503], length 0
1735294707.990122 IP (tos 0x0, ttl 64, id 0, offset 0, flags [none], proto TCP (6), length 52)
    192.168.178.40.50416 > 18.66.2.100.443: Flags [.], cksum 0xafd5 (correct), ack 6788, win 7135, options [nop,nop,TS val 2832575471 ecr 3493979503], length 0
1735294707.995804 IP (tos 0x0, ttl 64, id 0, offset 0, flags [none], proto TCP (6), length 87)
    192.168.178.40.50416 > 18.66.2.100.443: Flags [P.], cksum 0x7eba (correct), seq 628:663, ack 6788, win 7135, options [nop,nop,TS val 2832575477 ecr 3493979503], length 35
1735294708.054138 IP (tos 0x0, ttl 250, id 30763, offset 0, flags [none], proto TCP (6), length 52)
    18.66.2.100.443 > 192.168.178.40.50416: Flags [.], cksum 0xcaa3 (correct), ack 663, win 156, options [nop,nop,TS val 3493979579 ecr 2832575477], length 0
1735294708.396655 ARP, Ethernet (len 6), IPv4 (len 4), Request who-has 192.168.178.40 tell 192.168.178.21, length 46
1735294708.396710 ARP, Ethernet (len 6), IPv4 (len 4), Reply 192.168.178.40 is-at b0:de:28:72:17:b0, length 28
1735294708.806702 IP (tos 0x0, ttl 250, id 30764, offset 0, flags [none], proto TCP (6), length 1480)
    18.66.2.100.443 > 192.168.178.40.50416: Flags [.], cksum 0xa91b (correct), seq 6788:8216, ack 663, win 156, options [nop,nop,TS val 3493980248 ecr 2832575477], length 1428
1735294708.806706 IP (tos 0x0, ttl 250, id 30765, offset 0, flags [none], proto TCP (6), length 1480)
    18.66.2.100.443 > 192.168.178.40.50416: Flags [.], cksum 0xda2e (correct), seq 8216:9644, ack 663, win 156, options [nop,nop,TS val 3493980248 ecr 2832575477], length 1428
1735294708.806708 IP (tos 0x0, ttl 250, id 30766, offset 0, flags [none], proto TCP (6), length 1480)
    18.66.2.100.443 > 192.168.178.40.50416: Flags [.], cksum 0xbaa8 (correct), seq 9644:11072, ack 663, win 156, options [nop,nop,TS val 3493980248 ecr 2832575477], length 1428
1735294708.806710 IP (tos 0x0, ttl 250, id 30767, offset 0, flags [none], proto TCP (6), length 1480)
    18.66.2.100.443 > 192.168.178.40.50416: Flags [.], cksum 0x454d (correct), seq 11072:12500, ack 663, win 156, options [nop,nop,TS val 3493980248 ecr 2832575477], length 1428
1735294708.806952 IP (tos 0x0, ttl 64, id 0, offset 0, flags [none], proto TCP (6), length 52)
    192.168.178.40.50416 > 18.66.2.100.443: Flags [.], cksum 0x93a1 (correct), ack 12500, win 7046, options [nop,nop,TS val 2832576288 ecr 3493980248], length 0
1735294708.807250 IP (tos 0x0, ttl 64, id 0, offset 0, flags [none], proto TCP (6), length 52)
    192.168.178.40.50416 > 18.66.2.100.443: Flags [.], cksum 0x9348 (correct), ack 12500, win 7135, options [nop,nop,TS val 2832576288 ecr 3493980248], length 0
1735294708.807293 IP (tos 0x0, ttl 250, id 30768, offset 0, flags [none], proto TCP (6), length 1480)
    18.66.2.100.443 > 192.168.178.40.50416: Flags [.], cksum 0x7b0a (correct), seq 12500:13928, ack 663, win 156, options [nop,nop,TS val 3493980248 ecr 2832575477], length 1428
1735294708.807295 IP (tos 0x0, ttl 250, id 30769, offset 0, flags [none], proto TCP (6), length 1480)
    18.66.2.100.443 > 192.168.178.40.50416: Flags [.], cksum 0x62d8 (correct), seq 13928:15356, ack 663, win 156, options [nop,nop,TS val 3493980248 ecr 2832575477], length 1428
1735294708.807342 IP (tos 0x0, ttl 64, id 0, offset 0, flags [none], proto TCP (6), length 52)
    192.168.178.40.50416 > 18.66.2.100.443: Flags [.], cksum 0x884d (correct), ack 15356, win 7090, options [nop,nop,TS val 2832576288 ecr 3493980248], length 0
1735294708.807400 IP (tos 0x0, ttl 64, id 0, offset 0, flags [none], proto TCP (6), length 52)
    192.168.178.40.50416 > 18.66.2.100.443: Flags [.], cksum 0x8820 (correct), ack 15356, win 7135, options [nop,nop,TS val 2832576288 ecr 3493980248], length 0
1735294708.810554 IP (tos 0x0, ttl 250, id 30770, offset 0, flags [none], proto TCP (6), length 1480)
    18.66.2.100.443 > 192.168.178.40.50416: Flags [.], cksum 0x18ae (correct), seq 15356:16784, ack 663, win 156, options [nop,nop,TS val 3493980248 ecr 2832575477], length 1428
1735294708.810557 IP (tos 0x0, ttl 250, id 30771, offset 0, flags [none], proto TCP (6), length 1480)
    18.66.2.100.443 > 192.168.178.40.50416: Flags [.], cksum 0xf1f6 (correct), seq 16784:18212, ack 663, win 156, options [nop,nop,TS val 3493980248 ecr 2832575477], length 1428
1735294708.810702 IP (tos 0x0, ttl 64, id 0, offset 0, flags [none], proto TCP (6), length 52)
    192.168.178.40.50416 > 18.66.2.100.443: Flags [.], cksum 0x7d21 (correct), ack 18212, win 7090, options [nop,nop,TS val 2832576292 ecr 3493980248], length 0
1735294708.811387 IP (tos 0x0, ttl 64, id 0, offset 0, flags [none], proto TCP (6), length 52)
    192.168.178.40.50416 > 18.66.2.100.443: Flags [.], cksum 0x7cf4 (correct), ack 18212, win 7135, options [nop,nop,TS val 2832576292 ecr 3493980248], length 0
1735294708.811719 IP (tos 0x0, ttl 250, id 30772, offset 0, flags [none], proto TCP (6), length 1480)
    18.66.2.100.443 > 192.168.178.40.50416: Flags [.], cksum 0x5813 (correct), seq 18212:19640, ack 663, win 156, options [nop,nop,TS val 3493980248 ecr 2832575477], length 1428
1735294708.811721 IP (tos 0x0, ttl 250, id 30773, offset 0, flags [none], proto TCP (6), length 1480)
    18.66.2.100.443 > 192.168.178.40.50416: Flags [.], cksum 0x6a4f (correct), seq 19640:21068, ack 663, win 156, options [nop,nop,TS val 3493980248 ecr 2832575477], length 1428
1735294708.811723 IP (tos 0x0, ttl 250, id 30774, offset 0, flags [none], proto TCP (6), length 1480)
    18.66.2.100.443 > 192.168.178.40.50416: Flags [.], cksum 0x52e5 (correct), seq 21068:22496, ack 663, win 156, options [nop,nop,TS val 3493980248 ecr 2832575477], length 1428
1735294708.811733 IP (tos 0x0, ttl 250, id 30775, offset 0, flags [none], proto TCP (6), length 750)
    18.66.2.100.443 > 192.168.178.40.50416: Flags [P.], cksum 0x6060 (correct), seq 22496:23194, ack 663, win 156, options [nop,nop,TS val 3493980248 ecr 2832575477], length 698
1735294708.811734 IP (tos 0x0, ttl 250, id 30776, offset 0, flags [none], proto TCP (6), length 1480)
    18.66.2.100.443 > 192.168.178.40.50416: Flags [.], cksum 0x6c10 (correct), seq 23194:24622, ack 663, win 156, options [nop,nop,TS val 3493980249 ecr 2832575477], length 1428
1735294708.811735 IP (tos 0x0, ttl 250, id 30777, offset 0, flags [none], proto TCP (6), length 1480)
    18.66.2.100.443 > 192.168.178.40.50416: Flags [.], cksum 0x0e0c (correct), seq 24622:26050, ack 663, win 156, options [nop,nop,TS val 3493980249 ecr 2832575477], length 1428
1735294708.811737 IP (tos 0x0, ttl 250, id 30778, offset 0, flags [none], proto TCP (6), length 1480)
    18.66.2.100.443 > 192.168.178.40.50416: Flags [.], cksum 0x2872 (correct), seq 26050:27478, ack 663, win 156, options [nop,nop,TS val 3493980249 ecr 2832575477], length 1428
1735294708.811738 IP (tos 0x0, ttl 250, id 30779, offset 0, flags [none], proto TCP (6), length 1480)
    18.66.2.100.443 > 192.168.178.40.50416: Flags [.], cksum 0x7a6b (correct), seq 27478:28906, ack 663, win 156, options [nop,nop,TS val 3493980249 ecr 2832575477], length 1428
1735294708.811740 IP (tos 0x0, ttl 250, id 30780, offset 0, flags [none], proto TCP (6), length 1480)
    18.66.2.100.443 > 192.168.178.40.50416: Flags [.], cksum 0x78fe (correct), seq 28906:30334, ack 663, win 156, options [nop,nop,TS val 3493980249 ecr 2832575477], length 1428
1735294708.811741 IP (tos 0x0, ttl 250, id 30781, offset 0, flags [none], proto TCP (6), length 683)
    18.66.2.100.443 > 192.168.178.40.50416: Flags [P.], cksum 0x5e68 (correct), seq 30334:30965, ack 663, win 156, options [nop,nop,TS val 3493980249 ecr 2832575477], length 631
1735294708.811742 IP (tos 0x0, ttl 250, id 30782, offset 0, flags [none], proto TCP (6), length 1480)
    18.66.2.100.443 > 192.168.178.40.50416: Flags [.], cksum 0x0276 (correct), seq 30965:32393, ack 663, win 156, options [nop,nop,TS val 3493980249 ecr 2832575477], length 1428
1735294708.811743 IP (tos 0x0, ttl 250, id 30783, offset 0, flags [none], proto TCP (6), length 1480)
    18.66.2.100.443 > 192.168.178.40.50416: Flags [.], cksum 0xcf65 (correct), seq 32393:33821, ack 663, win 156, options [nop,nop,TS val 3493980249 ecr 2832575477], length 1428
1735294708.811745 IP (tos 0x0, ttl 250, id 30784, offset 0, flags [none], proto TCP (6), length 1480)
    18.66.2.100.443 > 192.168.178.40.50416: Flags [.], cksum 0xda5d (correct), seq 33821:35249, ack 663, win 156, options [nop,nop,TS val 3493980249 ecr 2832575477], length 1428
1735294708.811747 IP (tos 0x0, ttl 250, id 30785, offset 0, flags [none], proto TCP (6), length 1480)
    18.66.2.100.443 > 192.168.178.40.50416: Flags [.], cksum 0xc7ff (correct), seq 35249:36677, ack 663, win 156, options [nop,nop,TS val 3493980249 ecr 2832575477], length 1428
1735294708.811748 IP (tos 0x0, ttl 250, id 30786, offset 0, flags [none], proto TCP (6), length 1480)
    18.66.2.100.443 > 192.168.178.40.50416: Flags [.], cksum 0xf2e2 (correct), seq 36677:38105, ack 663, win 156, options [nop,nop,TS val 3493980249 ecr 2832575477], length 1428
1735294708.811749 IP (tos 0x0, ttl 250, id 30787, offset 0, flags [none], proto TCP (6), length 1480)
    18.66.2.100.443 > 192.168.178.40.50416: Flags [.], cksum 0xd046 (correct), seq 38105:39533, ack 663, win 156, options [nop,nop,TS val 3493980249 ecr 2832575477], length 1428
1735294708.811751 IP (tos 0x0, ttl 250, id 30788, offset 0, flags [none], proto TCP (6), length 467)
    18.66.2.100.443 > 192.168.178.40.50416: Flags [P.], cksum 0x9a5e (correct), seq 39533:39948, ack 663, win 156, options [nop,nop,TS val 3493980249 ecr 2832575477], length 415
1735294708.811754 IP (tos 0x0, ttl 250, id 30789, offset 0, flags [none], proto TCP (6), length 1480)
    18.66.2.100.443 > 192.168.178.40.50416: Flags [.], cksum 0xc526 (correct), seq 39948:41376, ack 663, win 156, options [nop,nop,TS val 3493980250 ecr 2832575477], length 1428
1735294708.811756 IP (tos 0x0, ttl 250, id 30790, offset 0, flags [none], proto TCP (6), length 1480)
    18.66.2.100.443 > 192.168.178.40.50416: Flags [.], cksum 0x0d36 (correct), seq 41376:42804, ack 663, win 156, options [nop,nop,TS val 3493980250 ecr 2832575477], length 1428
1735294708.811757 IP (tos 0x0, ttl 250, id 30791, offset 0, flags [none], proto TCP (6), length 1480)
    18.66.2.100.443 > 192.168.178.40.50416: Flags [.], cksum 0x4474 (correct), seq 42804:44232, ack 663, win 156, options [nop,nop,TS val 3493980250 ecr 2832575477], length 1428
1735294708.811758 IP (tos 0x0, ttl 250, id 30792, offset 0, flags [none], proto TCP (6), length 1480)
    18.66.2.100.443 > 192.168.178.40.50416: Flags [.], cksum 0x9b4b (correct), seq 44232:45660, ack 663, win 156, options [nop,nop,TS val 3493980250 ecr 2832575477], length 1428
1735294708.811760 IP (tos 0x0, ttl 250, id 30793, offset 0, flags [none], proto TCP (6), length 1480)
    18.66.2.100.443 > 192.168.178.40.50416: Flags [.], cksum 0x1f32 (correct), seq 45660:47088, ack 663, win 156, options [nop,nop,TS val 3493980250 ecr 2832575477], length 1428
1735294708.811761 IP (tos 0x0, ttl 250, id 30794, offset 0, flags [none], proto TCP (6), length 1480)
    18.66.2.100.443 > 192.168.178.40.50416: Flags [.], cksum 0x1300 (correct), seq 47088:48516, ack 663, win 156, options [nop,nop,TS val 3493980250 ecr 2832575477], length 1428
1735294708.811763 IP (tos 0x0, ttl 250, id 30795, offset 0, flags [none], proto TCP (6), length 1480)
    18.66.2.100.443 > 192.168.178.40.50416: Flags [.], cksum 0xc28a (correct), seq 48516:49944, ack 663, win 156, options [nop,nop,TS val 3493980250 ecr 2832575477], length 1428
1735294708.811764 IP (tos 0x0, ttl 250, id 30796, offset 0, flags [none], proto TCP (6), length 1480)
    18.66.2.100.443 > 192.168.178.40.50416: Flags [.], cksum 0x5c8c (correct), seq 49944:51372, ack 663, win 156, options [nop,nop,TS val 3493980250 ecr 2832575477], length 1428
